{"grao":"1 linha por dia do ciclo × hora × grupo, departamento NUTRITION, base inteira","dimensoes":{"grupo":["Fiéis","Regulares","Esporádicos","Sem segmento","Em pausa"]},"colunas":["dia_semana","hora","grupo","faturamento"],"linhas":[[1,0,0,119.59],[1,0,1,34.63],[1,0,2,2.99],[1,1,0,29.26],[1,1,1,1.0],[1,2,0,4.08],[1,2,1,10.47],[1,2,3,4.77],[1,3,0,11.46],[1,3,1,8.96],[1,3,4,6.99],[1,4,0,1.0],[1,4,1,5.98],[1,5,0,4.48],[1,5,1,9.99],[1,6,0,24.02],[1,6,1,2.58],[1,7,0,37.96],[1,7,1,13.37],[1,8,0,109.58],[1,8,1,52.78],[1,8,2,13.07],[1,9,0,187.99],[1,9,1,133.73],[1,9,2,11.57],[1,9,4,12.16],[1,10,0,412.81],[1,10,1,242.12],[1,10,2,14.66],[1,10,4,2.5],[1,10,3,4.0],[1,11,0,717.29],[1,11,1,210.58],[1,11,2,40.83],[1,11,4,10.32],[1,12,0,633.82],[1,12,1,247.82],[1,12,2,33.87],[1,12,4,9.77],[1,13,0,967.71],[1,13,1,273.71],[1,13,2,117.87],[1,13,4,20.47],[1,13,3,6.49],[1,14,0,646.94],[1,14,1,303.91],[1,14,2,16.54],[1,14,4,35.42],[1,14,3,6.79],[1,15,0,1028.84],[1,15,1,300.09],[1,15,2,33.89],[1,15,4,17.98],[1,15,3,38.53],[1,16,0,714.58],[1,16,1,292.55],[1,16,2,24.45],[1,16,3,8.99],[1,17,0,943.78],[1,17,1,421.85],[1,17,2,14.64],[1,17,4,28.74],[1,17,3,6.36],[1,18,0,876.45],[1,18,1,344.65],[1,18,2,106.29],[1,18,4,25.42],[1,18,3,15.96],[1,19,0,567.08],[1,19,1,245.58],[1,19,2,27.23],[1,19,3,6.97],[1,20,0,437.19],[1,20,1,176.77],[1,20,2,6.78],[1,20,4,9.87],[1,20,3,23.61],[1,21,0,443.25],[1,21,1,129.69],[1,21,2,61.24],[1,21,4,1.49],[1,22,0,251.36],[1,22,1,79.23],[1,22,2,3.84],[1,22,4,5.98],[1,23,0,163.36],[1,23,1,58.17],[1,23,2,14.48],[2,0,0,37.43],[2,0,1,21.43],[2,0,2,1.78],[2,1,0,4.18],[2,1,1,13.55],[2,1,4,2.58],[2,2,0,3.4],[2,2,1,2.5],[2,3,1,9.46],[2,4,0,3.98],[2,4,1,10.77],[2,5,0,2.49],[2,5,1,2.99],[2,6,0,3.59],[2,6,1,3.99],[2,7,0,56.78],[2,7,1,15.46],[2,8,0,98.15],[2,8,1,59.35],[2,8,2,1.99],[2,8,4,19.99],[2,9,0,258.35],[2,9,1,108.38],[2,9,2,12.94],[2,9,4,5.88],[2,10,0,599.96],[2,10,1,171.84],[2,10,2,14.49],[2,10,4,35.39],[2,10,3,3.99],[2,11,0,759.94],[2,11,1,312.85],[2,11,2,16.46],[2,11,4,22.07],[2,11,3,28.98],[2,12,0,926.98],[2,12,1,369.65],[2,12,2,19.94],[2,12,4,38.17],[2,12,3,46.02],[2,13,0,808.93],[2,13,1,409.49],[2,13,2,29.84],[2,13,4,7.23],[2,13,3,8.47],[2,14,0,1200.75],[2,14,1,428.12],[2,14,2,24.71],[2,14,4,26.01],[2,15,0,1067.31],[2,15,1,307.72],[2,15,2,57.19],[2,15,4,38.2],[2,16,0,1164.65],[2,16,1,311.52],[2,16,2,16.34],[2,16,4,9.06],[2,16,3,12.65],[2,17,0,1060.0],[2,17,1,486.88],[2,17,2,24.62],[2,17,4,13.64],[2,18,0,1185.3],[2,18,1,366.7],[2,18,2,107.25],[2,18,4,47.53],[2,18,3,22.64],[2,19,0,722.81],[2,19,1,243.15],[2,19,2,108.49],[2,19,4,10.18],[2,19,3,1.09],[2,20,0,652.07],[2,20,1,220.57],[2,20,2,52.35],[2,20,4,1.89],[2,21,0,405.28],[2,21,1,192.65],[2,21,2,23.6],[2,22,0,244.13],[2,22,1,143.24],[2,22,2,4.63],[2,22,4,6.49],[2,22,3,7.48],[2,23,0,47.69],[2,23,1,27.62],[2,23,3,2.49],[3,0,0,13.29],[3,0,1,3.38],[3,0,2,13.45],[3,1,0,5.29],[3,1,1,6.48],[3,2,0,5.06],[3,3,1,5.68],[3,3,4,11.46],[3,4,1,8.48],[3,5,0,7.96],[3,5,1,3.99],[3,5,4,3.99],[3,6,0,15.64],[3,6,1,5.0],[3,7,0,31.36],[3,7,1,35.13],[3,7,2,1.5],[3,8,0,118.25],[3,8,1,27.22],[3,8,2,3.98],[3,8,3,5.0],[3,9,0,317.39],[3,9,1,110.67],[3,9,2,34.82],[3,10,0,534.37],[3,10,1,122.22],[3,10,2,17.07],[3,10,4,9.98],[3,11,0,542.14],[3,11,1,180.9],[3,11,2,55.07],[3,11,4,12.74],[3,12,0,506.98],[3,12,1,283.82],[3,12,2,30.69],[3,12,4,25.27],[3,13,0,614.53],[3,13,1,156.16],[3,13,2,13.57],[3,13,4,11.31],[3,14,0,566.11],[3,14,1,179.12],[3,14,2,18.44],[3,14,4,38.03],[3,14,3,13.85],[3,15,0,799.3],[3,15,1,192.69],[3,15,2,55.39],[3,15,4,17.86],[3,15,3,4.38],[3,16,0,926.16],[3,16,1,374.12],[3,16,2,23.99],[3,16,4,15.98],[3,16,3,3.99],[3,17,0,1361.29],[3,17,1,431.66],[3,17,2,31.83],[3,17,4,57.52],[3,17,3,2.99],[3,18,0,1152.66],[3,18,1,388.49],[3,18,2,47.24],[3,18,4,10.04],[3,18,3,2.5],[3,19,0,822.32],[3,19,1,394.23],[3,19,2,27.89],[3,19,4,30.85],[3,19,3,34.4],[3,20,0,892.95],[3,20,1,227.87],[3,20,2,29.2],[3,20,4,7.16],[3,20,3,10.97],[3,21,0,501.66],[3,21,1,200.25],[3,21,2,18.83],[3,21,4,5.77],[3,21,3,20.47],[3,22,0,430.92],[3,22,1,103.23],[3,22,2,19.15],[3,22,4,7.67],[3,23,0,41.38],[3,23,1,56.61],[3,23,4,4.0],[4,0,0,55.07],[4,0,1,3.48],[4,0,4,9.38],[4,1,0,5.99],[4,1,1,10.98],[4,2,0,62.1],[4,2,1,6.98],[4,3,2,3.99],[4,5,0,21.56],[4,6,0,51.41],[4,6,1,5.37],[4,6,2,1.09],[4,7,0,99.71],[4,7,1,38.44],[4,7,2,3.88],[4,8,0,110.07],[4,8,1,10.99],[4,9,0,261.46],[4,9,1,34.31],[4,9,2,1.25],[4,9,3,2.99],[4,10,0,682.63],[4,10,1,187.61],[4,10,2,3.68],[4,10,4,13.96],[4,11,0,435.45],[4,11,1,169.13],[4,11,2,41.24],[4,11,4,6.96],[4,11,3,2.99],[4,12,0,650.7],[4,12,1,106.85],[4,12,2,7.57],[4,12,4,17.83],[4,12,3,15.76],[4,13,0,591.7],[4,13,1,150.02],[4,13,2,11.28],[4,13,4,22.51],[4,13,3,17.26],[4,14,0,625.24],[4,14,1,134.71],[4,14,2,38.28],[4,14,4,8.87],[4,14,3,19.98],[4,15,0,879.67],[4,15,1,137.97],[4,15,2,12.27],[4,15,4,31.54],[4,16,0,857.52],[4,16,1,275.99],[4,16,2,43.08],[4,16,4,4.89],[4,16,3,29.24],[4,17,0,1063.13],[4,17,1,289.82],[4,17,2,60.72],[4,17,4,4.67],[4,18,0,931.34],[4,18,1,307.28],[4,18,2,28.79],[4,18,4,15.47],[4,18,3,7.98],[4,19,0,748.08],[4,19,1,264.07],[4,19,2,48.6],[4,19,4,52.03],[4,20,0,544.77],[4,20,1,274.54],[4,20,2,40.68],[4,20,4,49.31],[4,20,3,10.0],[4,21,0,345.56],[4,21,1,186.83],[4,21,2,29.93],[4,22,0,166.34],[4,22,1,107.45],[4,22,2,31.74],[4,22,3,6.98],[4,23,0,103.36],[4,23,1,31.02],[4,23,2,10.73],[5,0,0,40.48],[5,0,1,9.99],[5,0,2,1.79],[5,1,0,29.33],[5,2,0,13.94],[5,3,0,7.99],[5,4,0,19.9],[5,4,1,6.98],[5,5,0,18.02],[5,5,1,2.0],[5,6,0,17.37],[5,6,1,7.19],[5,7,0,52.14],[5,7,1,11.17],[5,7,2,1.67],[5,7,3,5.58],[5,8,0,78.39],[5,8,1,56.47],[5,9,0,260.96],[5,9,1,74.21],[5,9,2,1.89],[5,9,4,7.28],[5,10,0,371.19],[5,10,1,70.82],[5,10,2,5.85],[5,10,3,3.0],[5,11,0,784.8],[5,11,1,151.43],[5,11,2,9.48],[5,11,4,18.78],[5,12,0,554.02],[5,12,1,161.3],[5,12,2,62.74],[5,12,4,4.91],[5,12,3,11.56],[5,13,0,489.09],[5,13,1,195.72],[5,13,2,98.65],[5,13,4,14.13],[5,13,3,35.43],[5,14,0,507.25],[5,14,1,190.05],[5,14,2,19.37],[5,14,4,14.56],[5,14,3,20.94],[5,15,0,490.07],[5,15,1,184.12],[5,15,2,30.27],[5,15,4,7.07],[5,15,3,2.99],[5,16,0,913.11],[5,16,1,368.09],[5,16,2,29.85],[5,16,4,65.46],[5,16,3,3.69],[5,17,0,827.76],[5,17,1,310.6],[5,17,2,52.15],[5,17,4,33.72],[5,17,3,20.28],[5,18,0,854.95],[5,18,1,346.2],[5,18,2,36.01],[5,18,4,18.99],[5,18,3,26.41],[5,19,0,795.28],[5,19,1,251.53],[5,19,2,10.85],[5,19,4,32.49],[5,19,3,1.79],[5,20,0,585.36],[5,20,1,222.22],[5,20,2,50.83],[5,20,4,9.32],[5,20,3,6.38],[5,21,0,473.46],[5,21,1,156.83],[5,21,2,20.0],[5,21,4,7.47],[5,22,0,203.78],[5,22,1,70.53],[5,22,2,14.03],[5,22,4,6.76],[5,22,3,5.41],[5,23,0,224.8],[5,23,1,24.17],[6,0,0,190.32],[6,0,1,14.98],[6,0,2,1.99],[6,0,4,5.98],[6,1,0,215.66],[6,1,1,22.16],[6,2,0,10.97],[6,2,1,2.0],[6,5,0,26.26],[6,5,1,6.36],[6,6,0,13.66],[6,6,2,1.0],[6,7,0,39.68],[6,7,1,19.41],[6,7,2,2.0],[6,8,0,182.09],[6,8,1,30.97],[6,8,2,5.0],[6,9,0,258.56],[6,9,1,107.22],[6,9,2,4.55],[6,10,0,360.69],[6,10,1,271.02],[6,10,2,19.81],[6,10,4,2.79],[6,11,0,449.27],[6,11,1,78.47],[6,11,2,42.43],[6,11,4,10.27],[6,11,3,9.5],[6,12,0,590.63],[6,12,1,116.0],[6,12,2,35.59],[6,12,3,1.99],[6,13,0,545.91],[6,13,1,215.07],[6,13,2,45.28],[6,13,4,8.36],[6,13,3,3.99],[6,14,0,685.89],[6,14,1,126.6],[6,14,2,19.77],[6,14,4,37.79],[6,15,0,546.78],[6,15,1,136.64],[6,15,2,44.33],[6,15,4,16.15],[6,15,3,15.94],[6,16,0,786.5],[6,16,1,275.75],[6,16,2,11.15],[6,16,4,7.48],[6,16,3,2.5],[6,17,0,950.53],[6,17,1,397.36],[6,17,2,69.06],[6,17,4,39.42],[6,17,3,2.39],[6,18,0,720.05],[6,18,1,278.79],[6,18,2,34.6],[6,18,4,30.22],[6,19,0,911.34],[6,19,1,296.07],[6,19,2,53.52],[6,19,4,9.54],[6,20,0,753.2],[6,20,1,280.67],[6,20,2,23.71],[6,20,4,15.44],[6,20,3,12.27],[6,21,0,534.87],[6,21,1,146.19],[6,21,2,35.24],[6,21,4,1.49],[6,21,3,2.38],[6,22,0,259.8],[6,22,1,45.77],[6,22,2,6.08],[6,23,0,389.96],[6,23,1,30.18],[6,23,2,2.79],[7,0,0,7.58],[7,0,1,22.97],[7,0,2,2.49],[7,1,0,32.7],[7,1,1,7.38],[7,2,0,26.51],[7,2,1,7.9],[7,3,0,12.67],[7,3,1,5.68],[7,4,0,10.35],[7,4,4,1.99],[7,5,0,7.67],[7,5,1,16.47],[7,5,2,6.07],[7,6,0,9.67],[7,6,1,7.0],[7,7,0,54.35],[7,7,1,20.24],[7,8,0,175.36],[7,8,1,16.96],[7,9,0,144.2],[7,9,1,16.35],[7,9,2,2.98],[7,9,4,12.36],[7,10,0,611.4],[7,10,1,133.13],[7,10,2,2.99],[7,10,4,23.81],[7,10,3,9.48],[7,11,0,479.3],[7,11,1,168.45],[7,11,2,11.31],[7,11,4,22.05],[7,11,3,19.17],[7,12,0,522.46],[7,12,1,189.34],[7,12,2,29.17],[7,12,4,17.94],[7,12,3,5.0],[7,13,0,498.51],[7,13,1,173.73],[7,13,2,27.04],[7,13,4,11.46],[7,13,3,4.78],[7,14,0,755.5],[7,14,1,269.36],[7,14,2,12.91],[7,14,4,13.27],[7,15,0,923.68],[7,15,1,186.29],[7,15,2,46.81],[7,15,4,9.98],[7,15,3,2.99],[7,16,0,647.53],[7,16,1,309.53],[7,16,2,10.97],[7,16,4,34.15],[7,16,3,15.16],[7,17,0,838.75],[7,17,1,279.95],[7,17,2,15.15],[7,17,4,47.53],[7,18,0,858.3],[7,18,1,344.06],[7,18,2,16.65],[7,18,4,8.74],[7,18,3,2.49],[7,19,0,819.22],[7,19,1,211.19],[7,19,2,30.49],[7,19,4,3.0],[7,19,3,2.0],[7,20,0,980.51],[7,20,1,159.94],[7,20,2,10.47],[7,20,3,1.99],[7,21,0,962.96],[7,21,1,122.01],[7,21,2,18.19],[7,21,4,5.24],[7,22,0,744.59],[7,22,1,70.83],[7,22,2,5.89],[7,22,4,3.99],[7,23,0,116.45],[7,23,1,82.96],[7,23,2,7.96]]}