{"grao":"1 linha por dia do ciclo × hora × grupo, departamento DAIRY DELI, base inteira","dimensoes":{"grupo":["Regulares","Fiéis","Sem segmento","Em pausa","Esporádicos"]},"colunas":["dia_semana","hora","grupo","faturamento"],"linhas":[[1,11,0,0.88],[1,14,1,1.95],[1,14,2,5.78],[1,16,1,1.88],[1,17,0,0.88],[1,18,3,0.88],[2,0,0,0.95],[2,8,4,2.0],[2,9,0,1.9],[2,12,0,0.5],[2,14,1,0.95],[2,14,0,2.64],[2,16,0,3.52],[2,17,1,0.88],[2,22,1,0.88],[3,9,0,1.76],[3,15,1,0.88],[3,18,1,1.76],[3,19,1,0.88],[4,12,0,2.0],[4,13,0,3.52],[4,15,1,0.95],[4,18,1,3.8],[4,20,1,0.95],[4,20,0,1.09],[5,10,4,0.88],[5,13,1,0.95],[5,15,1,2.04],[5,17,0,2.71],[5,18,1,0.95],[5,18,0,0.95],[5,20,0,2.85],[5,22,1,1.05],[5,22,0,0.95],[6,8,0,0.88],[6,10,1,0.95],[6,14,1,0.88],[6,17,1,0.88],[7,8,1,0.99],[7,9,1,2.85],[7,12,1,2.71],[7,16,1,1.76],[7,17,1,1.9],[7,18,1,1.09],[7,19,0,0.95]]}