{"grao":"1 linha por dia do ciclo × hora × grupo, departamento PHOTO, base inteira","dimensoes":{"grupo":["Fiéis","Regulares","Esporádicos"]},"colunas":["dia_semana","hora","grupo","faturamento"],"linhas":[[1,16,0,1.87],[2,14,0,2.49],[3,11,1,2.0],[3,17,1,2.49],[4,12,0,8.17],[4,14,1,2.0],[4,16,0,2.49],[5,11,0,1.99],[5,12,2,2.49],[5,14,0,2.0],[5,20,1,2.0],[5,21,0,2.24],[6,17,1,1.0],[7,1,0,3.19],[7,21,0,2.49],[7,22,0,2.49]]}