{"grao":"1 linha por dia do ciclo × hora × grupo, departamento SALAD BAR, base inteira","dimensoes":{"grupo":["Esporádicos","Fiéis","Regulares","Em pausa","Sem segmento"]},"colunas":["dia_semana","hora","grupo","faturamento"],"linhas":[[1,0,0,2.43],[1,6,1,8.18],[1,7,1,3.28],[1,8,1,41.3],[1,8,2,6.03],[1,9,1,84.26],[1,9,2,58.04],[1,9,3,10.11],[1,10,1,89.76],[1,10,2,43.52],[1,10,0,10.0],[1,11,1,217.35],[1,11,2,115.67],[1,11,0,22.67],[1,12,1,321.66],[1,12,2,83.53],[1,12,0,11.54],[1,13,1,221.4],[1,13,2,77.68],[1,13,0,13.16],[1,13,3,6.47],[1,14,1,242.63],[1,14,2,156.48],[1,14,0,10.57],[1,14,3,5.96],[1,15,1,244.11],[1,15,2,86.36],[1,15,0,19.45],[1,15,3,8.38],[1,15,4,6.41],[1,16,1,297.89],[1,16,2,144.9],[1,16,0,2.96],[1,16,3,8.54],[1,17,1,251.62],[1,17,2,155.38],[1,17,0,48.81],[1,17,3,6.22],[1,18,1,284.34],[1,18,2,154.87],[1,18,0,12.1],[1,18,3,4.87],[1,18,4,11.33],[1,19,1,165.45],[1,19,2,100.27],[1,19,0,45.04],[1,19,4,2.47],[1,20,1,129.56],[1,20,2,68.31],[1,20,0,34.85],[1,21,1,31.87],[1,21,2,14.53],[1,22,1,4.15],[1,22,2,2.62],[1,23,1,4.06],[2,0,2,10.49],[2,7,1,9.08],[2,8,1,28.43],[2,8,2,4.62],[2,9,1,95.8],[2,9,2,21.54],[2,9,0,20.11],[2,9,3,5.63],[2,10,1,145.7],[2,10,2,58.92],[2,10,0,11.33],[2,10,3,11.69],[2,11,1,171.73],[2,11,2,103.19],[2,11,0,8.14],[2,11,3,13.06],[2,12,1,233.7],[2,12,2,142.99],[2,12,0,51.99],[2,12,3,2.43],[2,13,1,232.09],[2,13,2,146.98],[2,13,0,51.81],[2,13,3,2.84],[2,13,4,1.9],[2,14,1,232.95],[2,14,2,141.49],[2,14,0,23.3],[2,14,3,4.69],[2,14,4,3.23],[2,15,1,242.92],[2,15,2,103.81],[2,15,0,23.54],[2,15,3,3.35],[2,16,1,251.97],[2,16,2,151.74],[2,16,0,11.94],[2,16,3,2.77],[2,17,1,331.79],[2,17,2,117.25],[2,17,0,11.28],[2,18,1,292.67],[2,18,2,121.16],[2,18,0,16.4],[2,18,3,3.07],[2,19,1,253.12],[2,19,2,107.49],[2,19,0,28.61],[2,20,1,72.92],[2,20,2,25.63],[2,20,0,3.22],[2,21,1,20.44],[2,21,2,11.21],[2,21,0,2.27],[2,22,1,3.82],[2,22,2,2.63],[3,0,1,3.71],[3,0,2,11.0],[3,3,1,2.41],[3,7,1,12.37],[3,7,2,11.81],[3,8,1,22.4],[3,8,2,10.94],[3,8,0,2.35],[3,9,1,61.76],[3,9,2,45.48],[3,9,0,6.52],[3,10,1,78.8],[3,10,2,84.9],[3,10,0,27.06],[3,10,4,2.0],[3,11,1,399.08],[3,11,2,199.08],[3,11,0,18.73],[3,11,3,19.05],[3,11,4,3.25],[3,12,1,417.13],[3,12,2,235.99],[3,12,0,75.28],[3,12,3,5.62],[3,13,1,291.56],[3,13,2,165.76],[3,13,0,30.69],[3,13,3,10.45],[3,14,1,170.84],[3,14,2,92.89],[3,14,0,36.22],[3,14,3,13.5],[3,15,1,173.43],[3,15,2,122.09],[3,15,0,14.42],[3,15,3,18.5],[3,16,1,230.51],[3,16,2,69.67],[3,16,0,10.71],[3,16,3,14.74],[3,17,1,242.8],[3,17,2,103.28],[3,17,0,43.97],[3,17,3,13.4],[3,18,1,340.37],[3,18,2,165.64],[3,18,0,22.5],[3,18,3,5.6],[3,18,4,17.84],[3,19,1,221.79],[3,19,2,120.45],[3,19,0,23.23],[3,19,3,3.4],[3,19,4,3.18],[3,20,1,138.33],[3,20,2,51.62],[3,20,0,0.57],[3,20,3,8.64],[3,21,1,14.47],[3,21,2,9.52],[3,21,0,8.94],[3,22,1,10.67],[4,7,1,19.31],[4,7,0,7.31],[4,8,1,53.63],[4,8,2,7.82],[4,8,0,12.97],[4,9,1,70.95],[4,9,2,26.6],[4,10,1,64.6],[4,10,2,71.62],[4,10,0,21.34],[4,10,3,3.45],[4,11,1,328.62],[4,11,2,163.33],[4,11,0,15.6],[4,11,4,3.98],[4,12,1,371.71],[4,12,2,199.48],[4,12,0,52.83],[4,12,3,2.16],[4,13,1,235.13],[4,13,2,112.86],[4,13,0,2.08],[4,13,3,2.35],[4,13,4,6.86],[4,14,1,115.49],[4,14,2,115.1],[4,14,0,28.13],[4,15,1,199.86],[4,15,2,109.68],[4,15,0,12.11],[4,15,4,2.39],[4,16,1,195.39],[4,16,2,115.8],[4,16,0,4.87],[4,16,3,19.42],[4,17,1,313.45],[4,17,2,168.55],[4,17,0,22.72],[4,17,3,18.94],[4,17,4,1.82],[4,18,1,269.24],[4,18,2,116.56],[4,18,0,14.85],[4,18,3,1.2],[4,18,4,11.58],[4,19,1,176.47],[4,19,2,143.42],[4,19,0,7.1],[4,19,3,7.63],[4,20,1,117.78],[4,20,2,87.21],[4,20,0,3.03],[4,20,3,4.04],[4,21,1,32.6],[4,21,2,5.28],[4,21,0,3.24],[4,21,4,4.66],[4,22,1,4.83],[4,22,2,3.77],[4,23,1,6.11],[5,6,1,1.94],[5,7,1,24.88],[5,7,2,17.69],[5,7,0,4.15],[5,8,1,76.0],[5,8,2,11.97],[5,8,0,2.39],[5,8,3,2.77],[5,9,1,58.77],[5,9,2,62.15],[5,10,1,92.33],[5,10,2,64.11],[5,10,0,28.88],[5,11,1,303.86],[5,11,2,175.01],[5,11,0,67.62],[5,11,3,9.66],[5,12,1,374.77],[5,12,2,254.41],[5,12,0,29.48],[5,12,3,52.21],[5,12,4,5.91],[5,13,1,205.04],[5,13,2,123.46],[5,13,0,59.12],[5,13,3,6.47],[5,14,1,139.26],[5,14,2,65.33],[5,14,0,13.89],[5,14,3,12.47],[5,15,1,186.5],[5,15,2,79.85],[5,15,0,16.09],[5,15,3,23.46],[5,16,1,187.26],[5,16,2,142.72],[5,16,0,15.11],[5,16,3,7.68],[5,17,1,236.33],[5,17,2,126.21],[5,17,0,12.01],[5,17,3,10.65],[5,18,1,294.73],[5,18,2,128.17],[5,18,0,9.27],[5,18,3,16.42],[5,18,4,1.71],[5,19,1,193.38],[5,19,2,105.11],[5,19,0,14.0],[5,20,1,100.74],[5,20,2,78.96],[5,20,0,11.71],[5,20,3,1.2],[5,20,4,3.3],[5,21,1,32.27],[5,21,2,15.67],[5,21,0,3.7],[5,22,1,16.12],[5,22,2,3.14],[5,23,1,2.33],[5,23,2,1.14],[6,0,1,4.01],[6,6,1,0.88],[6,7,1,23.41],[6,7,0,4.24],[6,8,1,35.32],[6,8,2,9.79],[6,9,1,70.26],[6,9,2,26.94],[6,9,0,7.4],[6,9,3,10.12],[6,10,1,118.71],[6,10,2,88.05],[6,10,0,14.36],[6,10,3,6.06],[6,11,1,457.6],[6,11,2,149.25],[6,11,0,32.19],[6,12,1,321.73],[6,12,2,216.92],[6,12,0,66.41],[6,12,3,20.49],[6,12,4,4.43],[6,13,1,232.18],[6,13,2,105.91],[6,13,0,58.98],[6,13,3,5.84],[6,14,1,161.69],[6,14,2,135.02],[6,14,0,4.84],[6,14,4,9.24],[6,15,1,153.47],[6,15,2,84.37],[6,15,0,15.61],[6,15,3,27.03],[6,16,1,235.92],[6,16,2,74.41],[6,16,0,21.89],[6,16,3,5.57],[6,16,4,2.31],[6,17,1,306.01],[6,17,2,173.84],[6,17,0,25.32],[6,17,3,3.68],[6,18,1,253.97],[6,18,2,150.56],[6,18,0,22.92],[6,18,3,8.34],[6,19,1,194.81],[6,19,2,133.1],[6,19,0,24.2],[6,19,3,6.63],[6,20,1,90.34],[6,20,2,48.44],[6,20,0,4.47],[6,21,1,41.45],[6,21,2,7.14],[6,21,0,10.25],[6,21,3,3.86],[6,22,1,7.43],[6,22,0,6.61],[7,1,1,2.43],[7,2,1,2.71],[7,4,2,3.74],[7,6,1,2.15],[7,7,1,5.87],[7,7,0,1.8],[7,8,1,66.82],[7,8,2,16.26],[7,9,1,87.89],[7,9,2,11.45],[7,9,0,3.96],[7,9,3,4.25],[7,10,1,109.12],[7,10,2,60.94],[7,10,0,18.38],[7,10,3,8.98],[7,11,1,336.08],[7,11,2,112.44],[7,11,0,8.09],[7,11,3,3.79],[7,11,4,8.09],[7,12,1,287.74],[7,12,2,199.7],[7,12,0,40.52],[7,12,3,3.81],[7,12,4,3.03],[7,13,1,287.34],[7,13,2,117.65],[7,13,0,28.45],[7,13,3,0.88],[7,14,1,153.44],[7,14,2,96.58],[7,14,0,17.83],[7,14,3,6.7],[7,15,1,211.22],[7,15,2,70.8],[7,15,0,9.54],[7,15,3,6.54],[7,16,1,246.68],[7,16,2,105.54],[7,16,0,24.11],[7,16,3,4.63],[7,16,4,3.11],[7,17,1,251.2],[7,17,2,156.82],[7,17,0,4.46],[7,17,3,7.9],[7,18,1,211.51],[7,18,2,88.43],[7,18,3,9.05],[7,19,1,272.88],[7,19,2,65.94],[7,19,3,15.8],[7,20,1,110.14],[7,20,2,63.48],[7,20,0,6.26],[7,21,1,46.6],[7,21,2,6.31],[7,22,1,2.84],[7,23,2,4.39]]}