{"grao":"1 linha por dia do ciclo × hora × grupo, departamento GARDEN CENTER, base inteira","dimensoes":{"grupo":["Fiéis","Regulares","Sem segmento","Em pausa","Esporádicos"]},"colunas":["dia_semana","hora","grupo","faturamento"],"linhas":[[1,6,0,10.99],[1,8,0,8.0],[1,8,1,29.98],[1,9,0,19.98],[1,10,0,37.12],[1,10,1,30.0],[1,11,0,43.98],[1,12,0,70.02],[1,13,0,75.97],[1,13,1,12.99],[1,13,2,39.91],[1,14,0,110.05],[1,14,1,30.56],[1,15,0,259.31],[1,15,1,28.98],[1,15,2,7.99],[1,16,0,215.91],[1,16,1,5.0],[1,16,3,39.95],[1,17,0,178.42],[1,17,1,8.0],[1,18,0,36.49],[1,18,1,1.0],[1,18,2,14.99],[1,19,0,70.09],[1,19,1,45.94],[1,19,4,32.98],[1,20,0,7.99],[1,21,0,13.98],[1,21,1,99.87],[1,23,1,14.99],[2,7,0,2.58],[2,7,4,1.08],[2,8,0,3.34],[2,9,0,18.99],[2,9,1,10.99],[2,9,3,15.98],[2,10,0,104.48],[2,10,1,4.58],[2,10,4,13.99],[2,11,0,156.26],[2,11,1,10.77],[2,12,0,71.0],[2,12,1,42.97],[2,12,4,12.98],[2,12,3,14.99],[2,13,0,99.5],[2,14,0,117.8],[2,14,1,32.96],[2,15,0,95.43],[2,15,1,3.59],[2,16,0,40.12],[2,17,0,27.47],[2,17,1,13.34],[2,18,0,48.13],[2,18,1,6.45],[2,19,0,18.13],[2,20,0,32.57],[2,20,1,12.99],[2,22,0,14.99],[2,23,0,6.45],[3,8,0,12.99],[3,8,1,9.99],[3,9,0,13.66],[3,9,1,20.0],[3,10,0,60.94],[3,11,0,77.93],[3,12,0,161.32],[3,12,1,27.98],[3,13,0,47.56],[3,13,1,17.15],[3,14,0,10.98],[3,14,1,11.33],[3,15,0,29.97],[3,15,1,51.96],[3,16,0,90.94],[3,16,1,20.99],[3,16,4,2.58],[3,17,0,208.69],[3,17,1,4.0],[3,18,0,49.15],[3,18,1,20.99],[3,19,0,197.46],[3,20,0,29.76],[3,21,0,21.97],[3,23,1,5.16],[4,7,0,39.98],[4,7,4,13.99],[4,8,0,12.99],[4,9,0,62.3],[4,9,1,5.98],[4,10,0,2.0],[4,11,0,12.77],[4,12,0,49.74],[4,12,1,13.99],[4,13,0,59.65],[4,14,0,16.86],[4,14,1,10.78],[4,15,0,49.44],[4,15,1,8.47],[4,16,0,29.74],[4,16,1,63.92],[4,17,0,55.54],[4,17,1,25.98],[4,18,0,82.6],[4,18,1,44.94],[4,19,0,13.15],[4,19,1,15.99],[4,20,0,56.29],[4,20,1,1.0],[4,21,0,40.97],[4,22,0,13.99],[5,0,0,2.0],[5,10,0,23.16],[5,10,2,3.0],[5,11,0,142.8],[5,11,1,15.56],[5,12,0,44.52],[5,12,1,28.35],[5,12,4,2.58],[5,13,0,28.98],[5,13,1,7.99],[5,14,0,104.9],[5,14,1,23.17],[5,15,0,142.9],[5,15,1,32.98],[5,16,0,123.86],[5,16,1,7.99],[5,17,0,89.64],[5,17,1,1.79],[5,18,0,42.29],[5,18,4,3.87],[5,18,3,12.99],[5,19,0,63.84],[5,20,0,12.99],[5,21,0,4.74],[6,1,4,12.57],[6,9,0,1.0],[6,9,1,19.98],[6,10,0,81.02],[6,11,0,25.95],[6,11,1,4.99],[6,12,0,264.81],[6,12,1,15.05],[6,13,0,130.91],[6,13,1,19.98],[6,13,3,12.99],[6,14,0,72.12],[6,14,1,68.97],[6,15,0,67.13],[6,15,1,6.0],[6,16,0,34.97],[6,17,0,62.96],[6,17,1,12.99],[6,18,0,46.95],[6,18,1,22.27],[6,19,0,19.76],[6,19,1,13.78],[6,20,0,40.95],[6,21,0,11.98],[7,1,1,3.87],[7,6,0,38.97],[7,8,1,13.99],[7,9,0,12.99],[7,10,0,14.98],[7,11,0,20.98],[7,11,1,51.95],[7,11,4,3.98],[7,11,3,10.04],[7,12,0,33.57],[7,12,3,3.59],[7,13,0,230.98],[7,13,1,11.99],[7,14,0,47.32],[7,14,1,13.99],[7,15,0,35.65],[7,15,1,59.91],[7,15,4,8.99],[7,16,0,16.0],[7,17,0,26.74],[7,18,0,106.71],[7,18,1,20.57],[7,19,0,68.91],[7,20,1,13.99],[7,20,2,25.98],[7,21,0,19.15],[7,21,3,2.16],[7,22,0,21.98],[7,23,1,7.99]]}