{"grao":"1 linha por dia do ciclo × hora × grupo, departamento SEAFOOD-PCKGD, base inteira","dimensoes":{"grupo":["Fiéis","Regulares","Esporádicos","Em pausa","Sem segmento"]},"colunas":["dia_semana","hora","grupo","faturamento"],"linhas":[[1,0,0,55.13],[1,0,1,21.27],[1,1,0,8.49],[1,1,1,17.97],[1,2,0,8.67],[1,2,1,4.89],[1,3,1,36.93],[1,4,0,21.96],[1,4,1,20.97],[1,6,0,5.99],[1,6,2,4.99],[1,7,0,26.16],[1,7,2,4.49],[1,7,3,4.79],[1,8,0,23.21],[1,8,1,48.09],[1,9,0,170.49],[1,9,1,111.71],[1,9,2,21.57],[1,9,3,14.98],[1,10,0,421.57],[1,10,1,103.38],[1,10,2,24.32],[1,10,3,27.26],[1,11,0,532.1],[1,11,1,140.77],[1,11,2,66.0],[1,11,3,29.95],[1,12,0,595.7],[1,12,1,208.22],[1,12,2,59.59],[1,13,0,633.85],[1,13,1,290.45],[1,13,2,40.0],[1,13,3,4.79],[1,13,4,7.99],[1,14,0,655.34],[1,14,1,267.15],[1,14,2,30.66],[1,14,3,10.0],[1,15,0,734.28],[1,15,1,412.07],[1,15,2,38.65],[1,15,3,11.08],[1,16,0,914.81],[1,16,1,293.85],[1,16,2,35.38],[1,17,0,759.84],[1,17,1,253.99],[1,17,2,46.94],[1,17,3,29.83],[1,18,0,544.94],[1,18,1,349.85],[1,18,2,17.98],[1,18,4,9.74],[1,19,0,355.39],[1,19,1,336.4],[1,19,2,11.6],[1,19,3,6.99],[1,19,4,10.99],[1,20,0,343.0],[1,20,1,235.55],[1,20,2,8.98],[1,20,3,12.48],[1,21,0,232.24],[1,21,1,122.0],[1,21,2,5.98],[1,21,3,15.96],[1,22,0,157.7],[1,22,1,131.21],[1,22,2,4.99],[1,23,0,72.92],[1,23,1,70.67],[1,23,2,9.48],[2,0,0,35.66],[2,0,1,29.77],[2,0,2,3.99],[2,1,1,21.47],[2,2,0,10.48],[2,3,0,6.49],[2,4,1,4.99],[2,5,0,8.78],[2,6,0,13.0],[2,7,0,25.96],[2,7,1,2.5],[2,8,0,67.8],[2,8,1,15.47],[2,9,0,159.06],[2,9,1,14.37],[2,9,2,23.96],[2,9,3,2.0],[2,10,0,290.68],[2,10,1,130.18],[2,10,2,24.14],[2,10,3,3.0],[2,11,0,581.24],[2,11,1,155.11],[2,11,2,25.15],[2,11,3,18.87],[2,11,4,2.99],[2,12,0,678.28],[2,12,1,262.62],[2,12,2,49.4],[2,12,4,19.99],[2,13,0,678.29],[2,13,1,311.41],[2,13,2,37.29],[2,13,3,9.98],[2,14,0,730.3],[2,14,1,287.99],[2,14,2,42.39],[2,14,3,1.69],[2,15,0,897.79],[2,15,1,284.83],[2,15,2,32.79],[2,16,0,754.56],[2,16,1,307.16],[2,16,2,49.7],[2,16,3,5.99],[2,16,4,10.99],[2,17,0,676.85],[2,17,1,296.19],[2,17,2,67.14],[2,17,4,9.99],[2,18,0,477.59],[2,18,1,336.58],[2,18,2,74.4],[2,18,3,30.98],[2,18,4,21.97],[2,19,0,475.9],[2,19,1,227.59],[2,19,2,39.4],[2,20,0,298.38],[2,20,1,166.09],[2,20,2,26.96],[2,20,3,5.99],[2,20,4,2.99],[2,21,0,217.07],[2,21,1,87.27],[2,21,2,18.94],[2,21,3,5.99],[2,22,0,113.76],[2,22,1,65.3],[2,22,2,32.72],[2,23,0,23.96],[2,23,1,40.83],[2,23,2,7.99],[3,0,0,40.62],[3,0,1,11.98],[3,1,0,18.43],[3,1,1,18.87],[3,2,0,8.98],[3,3,0,11.35],[3,3,1,15.98],[3,4,0,6.99],[3,5,0,4.69],[3,5,3,4.0],[3,6,0,6.5],[3,6,3,1.87],[3,7,0,34.92],[3,7,1,31.93],[3,8,0,22.54],[3,8,1,25.36],[3,8,3,5.99],[3,9,0,139.23],[3,9,1,103.64],[3,9,2,24.59],[3,10,0,189.67],[3,10,1,82.96],[3,10,2,4.49],[3,10,3,8.98],[3,11,0,354.2],[3,11,1,193.13],[3,11,2,27.46],[3,11,3,19.65],[3,12,0,422.1],[3,12,1,262.8],[3,12,2,12.16],[3,12,3,30.56],[3,13,0,429.9],[3,13,1,140.02],[3,13,2,43.72],[3,13,3,14.5],[3,14,0,414.98],[3,14,1,132.45],[3,14,2,19.68],[3,14,3,19.96],[3,14,4,1.79],[3,15,0,427.33],[3,15,1,181.83],[3,15,2,10.98],[3,15,3,7.19],[3,16,0,591.96],[3,16,1,324.25],[3,16,2,39.89],[3,16,3,17.67],[3,16,4,7.99],[3,17,0,617.08],[3,17,1,326.59],[3,17,2,35.94],[3,18,0,561.8],[3,18,1,328.88],[3,18,2,37.46],[3,18,3,11.23],[3,19,0,293.61],[3,19,1,163.07],[3,19,2,33.83],[3,19,3,40.32],[3,19,4,5.99],[3,20,0,379.65],[3,20,1,256.25],[3,20,2,42.68],[3,20,3,17.22],[3,20,4,1.69],[3,21,0,164.19],[3,21,1,98.34],[3,22,0,84.63],[3,22,1,68.8],[3,22,2,22.57],[3,22,3,2.99],[3,23,0,25.73],[3,23,1,15.47],[3,23,3,4.0],[4,0,0,37.41],[4,0,1,26.97],[4,1,0,4.99],[4,2,0,7.99],[4,2,1,3.99],[4,2,2,6.99],[4,3,0,10.98],[4,3,1,9.36],[4,4,0,12.98],[4,4,1,17.97],[4,5,0,2.49],[4,7,0,33.95],[4,7,1,17.28],[4,8,0,55.39],[4,8,1,12.99],[4,9,0,91.25],[4,9,1,71.88],[4,9,2,16.26],[4,9,3,13.98],[4,10,0,379.86],[4,10,1,44.24],[4,10,2,34.47],[4,10,3,17.97],[4,11,0,324.95],[4,11,1,37.2],[4,11,2,19.63],[4,11,3,4.0],[4,12,0,248.06],[4,12,1,79.56],[4,12,2,15.57],[4,12,3,5.99],[4,13,0,315.4],[4,13,1,169.57],[4,13,2,38.2],[4,13,3,7.99],[4,14,0,293.13],[4,14,1,180.38],[4,14,2,20.97],[4,14,3,5.49],[4,15,0,282.9],[4,15,1,150.56],[4,15,2,39.11],[4,15,3,42.63],[4,16,0,486.14],[4,16,1,238.87],[4,16,2,69.83],[4,16,3,5.0],[4,17,0,661.74],[4,17,1,302.68],[4,17,2,17.97],[4,17,3,23.16],[4,18,0,482.99],[4,18,1,286.16],[4,18,2,24.96],[4,18,3,1.0],[4,19,0,395.36],[4,19,1,274.21],[4,19,2,16.97],[4,19,3,10.98],[4,20,0,364.48],[4,20,1,187.65],[4,20,2,13.34],[4,20,3,12.39],[4,21,0,89.84],[4,21,1,65.78],[4,21,2,6.99],[4,22,0,52.98],[4,22,1,38.93],[4,22,2,19.85],[4,23,0,28.06],[4,23,1,26.98],[4,23,3,11.99],[5,0,0,71.71],[5,0,1,21.26],[5,0,3,5.99],[5,1,0,7.68],[5,2,1,10.68],[5,2,2,6.28],[5,3,0,6.19],[5,3,1,2.99],[5,5,0,3.99],[5,5,1,5.99],[5,7,0,12.18],[5,7,1,6.99],[5,7,3,2.49],[5,8,0,19.96],[5,8,1,39.26],[5,8,2,5.99],[5,8,3,23.94],[5,9,0,148.31],[5,9,1,36.42],[5,9,2,13.13],[5,10,0,83.37],[5,10,1,62.43],[5,10,2,1.0],[5,11,0,337.62],[5,11,1,102.58],[5,11,2,8.97],[5,11,3,7.18],[5,11,4,4.49],[5,12,0,328.7],[5,12,1,87.13],[5,12,2,33.54],[5,12,3,16.97],[5,13,0,371.52],[5,13,1,117.92],[5,13,2,40.44],[5,13,3,14.96],[5,14,0,360.04],[5,14,1,91.97],[5,14,2,21.45],[5,14,3,3.99],[5,15,0,351.49],[5,15,1,150.46],[5,15,2,76.15],[5,15,3,7.48],[5,16,0,554.62],[5,16,1,188.39],[5,16,2,37.49],[5,16,3,25.66],[5,17,0,570.28],[5,17,1,219.71],[5,17,3,21.98],[5,18,0,652.36],[5,18,1,258.51],[5,18,2,36.43],[5,18,3,16.97],[5,18,4,1.99],[5,19,0,425.67],[5,19,1,147.55],[5,19,2,72.44],[5,19,3,13.98],[5,20,0,325.86],[5,20,1,148.36],[5,20,2,9.19],[5,21,0,199.46],[5,21,1,96.15],[5,21,2,12.16],[5,22,0,101.6],[5,22,1,35.85],[5,22,2,2.99],[5,22,3,8.02],[5,23,0,22.07],[5,23,1,69.6],[5,23,3,6.98],[6,0,0,22.35],[6,0,1,73.32],[6,1,1,51.92],[6,2,1,15.98],[6,3,1,9.98],[6,5,2,5.99],[6,6,0,2.67],[6,7,0,23.71],[6,8,0,63.11],[6,8,1,26.84],[6,9,0,98.45],[6,9,1,26.55],[6,9,2,7.36],[6,9,3,1.59],[6,10,0,153.37],[6,10,1,96.66],[6,10,2,10.99],[6,10,3,1.99],[6,10,4,23.97],[6,11,0,290.62],[6,11,1,35.77],[6,11,2,30.96],[6,11,3,14.88],[6,12,0,417.81],[6,12,1,98.95],[6,12,2,36.64],[6,12,3,9.77],[6,13,0,472.82],[6,13,1,184.44],[6,13,2,19.98],[6,14,0,313.69],[6,14,1,135.17],[6,14,2,23.26],[6,14,3,9.87],[6,15,0,496.6],[6,15,1,151.26],[6,15,2,18.24],[6,15,3,17.53],[6,16,0,462.75],[6,16,1,244.43],[6,17,0,568.9],[6,17,1,188.06],[6,17,2,38.34],[6,17,3,10.68],[6,18,0,482.13],[6,18,1,223.08],[6,18,2,53.31],[6,19,0,405.8],[6,19,1,275.41],[6,19,2,35.54],[6,19,3,7.98],[6,20,0,331.27],[6,20,1,227.8],[6,20,2,3.99],[6,20,3,1.99],[6,21,0,137.26],[6,21,1,87.23],[6,21,2,36.95],[6,21,3,7.28],[6,22,0,62.65],[6,22,1,106.63],[6,22,2,3.99],[6,22,3,8.5],[6,23,0,16.44],[6,23,2,2.99],[6,23,3,5.98],[7,0,0,11.18],[7,0,1,18.46],[7,1,0,12.88],[7,1,1,5.69],[7,1,2,3.99],[7,3,0,8.68],[7,4,0,17.97],[7,5,4,2.99],[7,6,1,19.97],[7,7,0,13.47],[7,7,1,101.83],[7,7,2,3.0],[7,8,0,74.87],[7,8,1,33.17],[7,8,2,3.99],[7,9,0,109.9],[7,9,1,30.24],[7,9,2,8.24],[7,9,3,15.55],[7,10,0,316.75],[7,10,1,75.37],[7,10,2,5.99],[7,10,3,5.98],[7,11,0,273.72],[7,11,1,69.45],[7,11,2,38.45],[7,12,0,553.75],[7,12,1,136.3],[7,12,2,24.71],[7,12,3,12.67],[7,13,0,405.23],[7,13,1,102.16],[7,13,2,28.46],[7,13,3,3.64],[7,14,0,527.47],[7,14,1,213.66],[7,14,2,18.57],[7,14,3,15.08],[7,15,0,493.66],[7,15,1,210.24],[7,15,2,41.94],[7,15,3,42.93],[7,16,0,417.88],[7,16,1,229.19],[7,16,2,43.9],[7,16,3,28.94],[7,17,0,505.88],[7,17,1,286.44],[7,17,2,8.58],[7,17,3,20.97],[7,18,0,633.07],[7,18,1,288.51],[7,18,2,17.64],[7,18,3,19.27],[7,18,4,4.99],[7,19,0,527.46],[7,19,1,256.57],[7,19,2,56.72],[7,19,3,33.94],[7,20,0,252.05],[7,20,1,262.5],[7,20,2,54.78],[7,20,3,3.0],[7,21,0,346.14],[7,21,1,176.55],[7,21,2,19.47],[7,21,3,16.15],[7,22,0,163.13],[7,22,1,32.94],[7,22,2,31.87],[7,22,3,6.38],[7,23,0,54.98],[7,23,1,27.03],[7,23,3,5.99]]}