{"grao":"1 linha por dia do ciclo × hora × grupo, departamento RX, base inteira","dimensoes":{"grupo":["Fiéis","Regulares","Em pausa"]},"colunas":["dia_semana","hora","grupo","faturamento"],"linhas":[[1,12,0,5.89],[1,20,0,20.89],[3,8,0,7.99],[3,11,0,9.99],[3,18,1,1.19],[3,20,1,5.99],[4,16,1,20.89],[5,11,0,20.89],[5,14,2,9.98],[5,19,0,20.89],[5,22,0,5.99],[6,12,1,10.99],[6,17,0,5.99]]}