{"grao":"1 linha por dia do ciclo × hora × grupo, departamento AUTOMOTIVE, base inteira","dimensoes":{"grupo":["Fiéis","Regulares","Esporádicos","Em pausa"]},"colunas":["dia_semana","hora","grupo","faturamento"],"linhas":[[1,12,0,20.64],[1,15,0,24.7],[1,15,1,1.99],[1,16,1,3.49],[1,19,0,0.87],[2,13,0,5.39],[2,13,1,12.55],[2,14,1,19.2],[2,15,0,22.5],[2,16,0,4.45],[2,17,0,2.49],[2,17,1,12.99],[2,18,1,24.7],[3,0,2,10.78],[3,9,0,7.99],[3,12,0,2.95],[3,13,1,5.95],[3,14,1,4.5],[3,17,0,11.18],[3,17,1,0.5],[3,18,0,8.48],[3,19,1,2.5],[3,19,2,3.99],[4,11,0,14.54],[4,13,0,0.75],[4,16,1,13.41],[4,17,0,9.99],[5,12,1,1.99],[5,13,2,0.5],[5,13,3,28.7],[5,14,0,5.39],[5,15,1,7.19],[5,17,2,9.99],[5,21,1,6.5],[5,22,0,0.5],[6,6,1,9.99],[6,9,0,8.99],[6,15,1,33.66],[6,16,0,3.95],[6,17,1,2.0],[6,18,0,5.99],[6,19,0,3.99],[6,20,0,9.95],[6,20,1,7.19],[7,8,0,4.99],[7,9,0,0.99],[7,12,0,0.25],[7,15,0,2.25],[7,17,0,17.99],[7,18,0,7.19],[7,20,0,8.08],[7,21,1,4.99],[7,22,1,5.99]]}