{"grao":"1 linha por dia do ciclo × hora × grupo, departamento CHEF SHOPPE, base inteira","dimensoes":{"grupo":["Fiéis","Regulares","Esporádicos","Em pausa","Sem segmento"]},"colunas":["dia_semana","hora","grupo","faturamento"],"linhas":[[1,0,0,1.99],[1,9,0,5.0],[1,10,0,23.45],[1,10,1,2.99],[1,11,0,22.45],[1,11,1,9.2],[1,11,2,1.0],[1,12,0,11.95],[1,12,1,13.81],[1,13,0,17.26],[1,13,1,13.48],[1,13,2,3.98],[1,14,0,27.44],[1,14,1,1.99],[1,15,0,54.37],[1,15,1,2.5],[1,15,2,1.99],[1,16,0,29.92],[1,16,1,14.46],[1,16,2,2.5],[1,17,0,40.89],[1,17,1,9.98],[1,18,0,29.43],[1,18,1,12.48],[1,18,2,2.5],[1,19,0,20.95],[1,19,1,3.99],[1,19,2,2.99],[1,20,0,32.93],[1,20,1,5.0],[1,21,1,1.99],[1,23,0,2.99],[2,8,2,1.99],[2,9,0,6.99],[2,9,1,2.99],[2,10,0,10.99],[2,10,1,7.5],[2,10,2,1.99],[2,11,0,25.43],[2,11,1,5.48],[2,11,3,3.99],[2,12,0,24.95],[2,12,1,7.47],[2,13,0,21.95],[2,13,1,21.47],[2,14,0,41.65],[2,14,1,5.48],[2,15,0,38.12],[2,15,1,9.47],[2,15,2,2.5],[2,16,0,9.98],[2,16,1,8.48],[2,17,0,28.93],[2,17,1,18.96],[2,17,3,2.5],[2,18,0,23.96],[2,18,1,16.46],[2,18,2,5.98],[2,19,0,9.47],[2,19,1,8.98],[2,20,0,2.99],[2,20,1,2.49],[2,21,0,11.49],[2,22,1,3.99],[3,8,0,2.5],[3,9,0,2.5],[3,10,0,9.48],[3,10,1,2.5],[3,11,0,14.47],[3,12,0,23.41],[3,12,1,12.97],[3,13,0,16.95],[3,13,1,6.97],[3,14,0,11.97],[3,14,1,8.96],[3,15,0,30.23],[3,15,1,8.98],[3,16,0,26.39],[3,16,1,21.94],[3,16,2,1.99],[3,17,0,27.94],[3,17,1,7.48],[3,18,0,37.5],[3,18,1,11.57],[3,18,2,6.48],[3,19,0,2.5],[3,19,1,9.47],[3,20,0,17.46],[3,20,1,9.97],[3,21,0,5.0],[3,21,1,2.5],[3,22,0,5.98],[3,22,2,2.99],[4,7,1,2.5],[4,8,0,2.99],[4,9,0,2.5],[4,9,1,2.5],[4,10,0,10.47],[4,10,1,14.46],[4,11,0,16.46],[4,11,2,1.99],[4,12,0,23.95],[4,12,1,2.99],[4,13,0,17.46],[4,14,0,17.44],[4,14,1,4.49],[4,14,2,2.99],[4,15,0,11.95],[4,15,1,2.5],[4,16,0,17.45],[4,16,1,5.49],[4,17,0,17.96],[4,17,1,8.97],[4,17,2,3.99],[4,18,0,33.91],[4,18,1,6.97],[4,18,4,3.49],[4,19,0,23.95],[4,19,2,8.97],[4,20,0,7.97],[4,20,1,5.48],[4,21,0,2.99],[4,21,1,2.5],[4,22,0,2.5],[4,23,0,2.99],[5,1,3,1.99],[5,7,0,4.98],[5,8,0,2.5],[5,9,0,2.5],[5,9,3,2.5],[5,10,0,5.98],[5,10,1,2.5],[5,11,0,6.99],[5,11,1,2.5],[5,12,0,12.97],[5,12,1,1.99],[5,12,2,4.98],[5,13,0,7.49],[5,13,1,2.5],[5,14,0,18.46],[5,15,0,8.48],[5,15,1,7.97],[5,16,0,16.95],[5,16,1,7.47],[5,17,0,35.44],[5,18,0,18.45],[5,18,1,1.99],[5,19,0,8.48],[5,19,1,5.49],[5,20,0,17.45],[5,20,2,2.99],[5,21,0,6.99],[5,21,1,7.48],[5,22,0,1.99],[6,0,0,2.49],[6,1,0,2.5],[6,9,0,2.49],[6,10,0,5.49],[6,10,1,1.99],[6,11,0,11.47],[6,12,0,8.22],[6,12,1,9.97],[6,13,0,10.96],[6,13,1,2.5],[6,13,3,3.99],[6,14,0,23.92],[6,14,1,1.99],[6,15,0,28.78],[6,15,1,2.5],[6,15,2,1.99],[6,16,0,17.95],[6,17,0,14.02],[6,17,1,12.99],[6,17,2,2.5],[6,18,0,20.28],[6,18,1,14.46],[6,19,0,14.46],[6,19,1,13.46],[6,20,0,10.97],[6,20,1,5.49],[6,21,0,6.99],[6,22,0,5.49],[6,22,1,2.99],[6,23,1,3.98],[7,8,0,5.49],[7,9,0,2.5],[7,9,3,2.99],[7,10,0,25.46],[7,11,0,19.95],[7,11,1,3.98],[7,12,0,2.5],[7,12,2,2.5],[7,13,0,18.13],[7,13,1,4.49],[7,14,0,5.98],[7,15,0,6.97],[7,15,1,24.93],[7,16,0,34.91],[7,16,1,8.47],[7,16,2,5.49],[7,17,0,21.47],[7,17,1,16.96],[7,18,0,14.96],[7,18,1,4.98],[7,19,0,13.94],[7,19,1,6.99],[7,20,0,11.21],[7,20,1,4.98],[7,20,2,2.5],[7,21,0,2.5],[7,21,1,2.99],[7,23,1,2.99]]}