{"grao":"1 linha por dia do ciclo × hora × grupo, departamento RESTAURANT, base inteira","dimensoes":{"grupo":["Fiéis","Regulares","Esporádicos","Em pausa"]},"colunas":["dia_semana","hora","grupo","faturamento"],"linhas":[[1,7,0,0.0],[1,8,0,10.99],[1,8,1,3.6],[1,10,0,18.05],[1,10,1,9.95],[1,11,0,17.09],[1,11,1,20.05],[1,12,0,20.54],[1,12,1,1.36],[1,13,0,34.66],[1,14,0,9.69],[1,15,0,6.8],[1,15,1,12.49],[1,16,0,29.89],[1,16,1,19.85],[1,17,0,60.94],[1,17,1,1.04],[1,18,0,21.34],[1,18,1,7.67],[1,19,0,45.28],[1,19,1,37.28],[1,19,2,4.4],[1,22,1,4.99],[1,22,2,7.8],[2,7,0,7.0],[2,9,0,24.95],[2,10,0,8.72],[2,11,0,36.08],[2,11,1,3.87],[2,12,0,15.9],[2,12,1,3.71],[2,13,0,9.2],[2,14,0,17.64],[2,15,0,22.19],[2,15,1,14.55],[2,16,0,48.37],[2,16,1,5.4],[2,16,2,1.95],[2,17,0,18.04],[2,17,1,8.02],[2,18,0,8.09],[2,18,1,1.56],[2,19,0,5.3],[2,21,0,7.37],[3,7,1,0.0],[3,8,1,5.3],[3,9,0,15.91],[3,10,0,5.83],[3,11,0,29.77],[3,11,1,7.2],[3,13,0,3.95],[3,13,1,12.33],[3,14,0,5.3],[3,14,1,0.78],[3,15,0,24.19],[3,16,0,38.45],[3,17,0,40.36],[3,17,1,13.46],[3,18,0,9.89],[3,19,0,1.4],[3,20,0,1.99],[3,20,1,4.36],[4,7,1,3.8],[4,9,0,4.9],[4,10,0,4.2],[4,11,0,16.5],[4,11,1,1.99],[4,12,0,11.36],[4,12,1,4.54],[4,13,0,1.95],[4,13,1,2.49],[4,14,0,1.7],[4,14,1,3.8],[4,14,2,3.9],[4,15,0,7.81],[4,16,0,18.39],[4,16,1,1.99],[4,17,0,30.57],[4,18,0,12.02],[4,18,1,8.22],[4,20,0,15.39],[4,20,1,1.95],[4,21,0,11.53],[5,6,1,3.8],[5,8,1,9.0],[5,9,0,4.75],[5,10,0,45.89],[5,11,0,3.09],[5,12,0,65.84],[5,13,0,10.19],[5,13,1,7.95],[5,14,0,27.1],[5,15,0,9.7],[5,16,1,7.2],[5,17,0,20.82],[5,17,1,1.24],[5,18,0,9.45],[5,18,1,2.5],[5,19,0,33.6],[5,19,1,7.62],[5,20,0,1.95],[5,21,0,10.95],[5,21,1,12.95],[6,7,1,23.8],[6,8,0,1.8],[6,8,1,7.25],[6,9,0,4.75],[6,9,1,3.0],[6,10,0,25.6],[6,10,1,2.94],[6,11,0,23.49],[6,11,1,12.3],[6,12,0,22.55],[6,12,1,13.13],[6,13,0,13.04],[6,14,0,18.33],[6,15,0,11.91],[6,16,0,22.23],[6,16,1,14.11],[6,17,0,12.38],[6,18,0,18.42],[6,18,1,1.48],[6,19,0,9.05],[6,20,0,13.29],[6,21,0,5.45],[7,1,0,1.8],[7,6,1,3.8],[7,7,0,1.8],[7,7,1,3.8],[7,8,0,5.5],[7,8,1,7.5],[7,9,0,14.6],[7,10,0,3.15],[7,10,1,2.5],[7,11,0,7.05],[7,11,1,3.6],[7,12,0,30.5],[7,13,0,3.75],[7,13,1,6.09],[7,14,0,34.73],[7,14,1,3.5],[7,15,0,5.6],[7,16,0,8.19],[7,17,0,18.46],[7,17,1,7.48],[7,18,0,36.49],[7,18,1,1.8],[7,19,3,1.95],[7,20,0,64.09],[7,20,1,22.9],[7,21,0,5.04],[7,21,1,10.15],[7,22,0,18.28]]}