{"grao":"1 linha por dia do ciclo × hora × grupo, departamento POSTAL CENTER, base inteira","dimensoes":{"grupo":["Regulares","Fiéis","Esporádicos"]},"colunas":["dia_semana","hora","grupo","faturamento"],"linhas":[[1,11,0,1.32],[1,12,1,0.33],[1,13,1,1.0],[1,16,1,0.66],[2,20,1,0.66],[3,8,0,1.89],[3,16,1,8.95],[4,2,1,1.0],[4,19,1,0.33],[5,12,0,1.58],[6,15,0,0.33],[6,22,1,1.5],[7,12,0,1.49],[7,17,1,0.33],[7,23,2,0.33]]}