{"grao":"1 linha por dia do ciclo × hora × grupo, departamento FLORAL, base inteira","dimensoes":{"grupo":["Fiéis","Regulares","Esporádicos","Em pausa","Sem segmento"]},"colunas":["dia_semana","hora","grupo","faturamento"],"linhas":[[1,0,0,33.97],[1,0,1,30.3],[1,2,1,12.99],[1,4,1,3.99],[1,4,2,15.0],[1,5,0,24.68],[1,6,0,49.25],[1,6,1,5.99],[1,7,0,55.91],[1,7,1,25.0],[1,7,2,10.0],[1,8,0,56.91],[1,8,1,78.24],[1,9,0,244.68],[1,9,1,171.41],[1,9,2,21.96],[1,9,3,29.98],[1,9,4,25.98],[1,10,0,269.69],[1,10,1,113.39],[1,10,2,51.9],[1,11,0,396.61],[1,11,1,114.76],[1,11,2,16.94],[1,11,3,45.98],[1,12,0,588.51],[1,12,1,154.36],[1,12,2,39.95],[1,12,3,4.99],[1,13,0,595.59],[1,13,1,244.74],[1,13,3,2.99],[1,13,4,8.0],[1,14,0,654.21],[1,14,1,258.98],[1,14,2,56.96],[1,15,0,542.87],[1,15,1,141.15],[1,15,2,69.43],[1,16,0,443.14],[1,16,1,172.24],[1,16,2,31.98],[1,17,0,353.92],[1,17,1,123.18],[1,17,2,57.95],[1,18,0,358.6],[1,18,1,192.44],[1,18,3,9.99],[1,19,0,284.16],[1,19,1,126.79],[1,19,2,8.97],[1,20,0,229.93],[1,20,1,39.42],[1,20,2,15.98],[1,21,0,218.84],[1,21,1,60.97],[1,21,2,12.99],[1,22,0,101.83],[1,22,1,35.28],[1,22,2,22.98],[1,22,3,3.34],[1,23,0,38.69],[1,23,1,30.96],[2,0,0,3.99],[2,0,1,12.99],[2,1,1,20.98],[2,6,0,7.99],[2,7,0,32.98],[2,7,1,12.99],[2,7,2,20.0],[2,8,0,110.58],[2,8,1,84.93],[2,9,0,123.32],[2,9,1,78.41],[2,9,2,6.97],[2,10,0,454.41],[2,10,1,53.97],[2,10,2,34.95],[2,10,3,1.0],[2,11,0,523.82],[2,11,1,79.93],[2,11,2,30.48],[2,11,4,5.0],[2,12,0,513.17],[2,12,1,96.37],[2,12,2,9.99],[2,13,0,415.69],[2,13,1,117.84],[2,13,2,33.98],[2,13,3,6.99],[2,13,4,4.99],[2,14,0,596.37],[2,14,1,116.04],[2,14,2,7.0],[2,14,3,5.0],[2,15,0,458.77],[2,15,1,65.4],[2,15,2,62.94],[2,16,0,254.56],[2,16,1,75.9],[2,16,2,24.98],[2,16,3,2.99],[2,16,4,17.99],[2,17,0,190.51],[2,17,1,147.37],[2,17,2,13.98],[2,17,4,20.98],[2,18,0,163.16],[2,18,1,79.22],[2,18,2,9.99],[2,19,0,111.75],[2,19,1,13.99],[2,19,2,35.96],[2,20,0,105.23],[2,20,1,90.91],[2,21,0,89.96],[2,21,1,16.48],[2,22,0,59.43],[2,22,1,24.99],[2,22,2,18.99],[2,23,0,1.0],[3,0,1,2.99],[3,3,0,9.99],[3,4,1,2.99],[3,5,1,2.5],[3,6,1,29.98],[3,7,0,36.08],[3,7,1,19.99],[3,7,3,13.98],[3,8,0,49.92],[3,8,1,12.98],[3,9,0,88.06],[3,9,1,14.98],[3,10,0,76.48],[3,10,1,134.12],[3,10,2,10.99],[3,10,3,7.99],[3,11,0,118.02],[3,11,1,26.98],[3,11,2,14.99],[3,11,3,2.5],[3,12,0,158.2],[3,12,1,55.94],[3,12,3,5.98],[3,13,0,198.79],[3,13,1,78.85],[3,13,2,17.99],[3,14,0,250.24],[3,14,1,106.25],[3,14,2,67.97],[3,15,0,149.91],[3,15,1,44.84],[3,15,3,12.99],[3,15,4,8.0],[3,16,0,222.68],[3,16,1,143.17],[3,16,2,41.96],[3,17,0,207.78],[3,17,1,87.9],[3,17,2,4.99],[3,17,3,5.0],[3,18,0,262.63],[3,18,1,68.65],[3,18,2,4.5],[3,19,0,222.12],[3,19,1,85.56],[3,19,2,0.69],[3,20,0,193.48],[3,20,1,99.9],[3,20,2,14.48],[3,21,0,84.63],[3,21,1,34.97],[3,21,2,3.48],[3,22,0,49.22],[3,22,1,32.99],[3,22,2,6.0],[3,23,0,78.63],[3,23,1,30.97],[4,0,1,9.0],[4,2,1,12.99],[4,5,0,12.99],[4,6,0,9.99],[4,6,1,12.99],[4,7,0,31.98],[4,7,1,12.98],[4,8,0,77.88],[4,8,1,23.87],[4,9,0,52.94],[4,9,1,32.95],[4,10,0,102.39],[4,10,1,54.64],[4,11,0,143.8],[4,11,1,86.91],[4,11,2,9.99],[4,12,0,159.79],[4,12,1,66.95],[4,12,2,2.99],[4,12,3,5.99],[4,12,4,7.99],[4,13,0,184.43],[4,13,1,66.95],[4,13,2,18.98],[4,14,0,253.08],[4,14,1,96.28],[4,14,2,21.98],[4,14,3,10.0],[4,15,0,215.16],[4,15,1,47.95],[4,15,2,12.99],[4,15,3,1.99],[4,16,0,253.7],[4,16,1,125.71],[4,16,2,25.98],[4,17,0,300.57],[4,17,1,127.26],[4,17,2,81.97],[4,17,3,18.34],[4,18,0,302.07],[4,18,1,79.29],[4,18,2,29.99],[4,18,3,8.98],[4,19,0,156.33],[4,19,1,77.92],[4,19,2,7.5],[4,20,0,171.64],[4,20,1,80.94],[4,20,2,20.98],[4,21,0,57.91],[4,21,1,20.49],[4,22,0,107.73],[4,22,1,27.97],[4,23,0,16.97],[4,23,1,24.77],[5,0,1,7.99],[5,1,2,4.49],[5,2,1,25.98],[5,3,1,5.99],[5,5,0,17.99],[5,5,1,14.99],[5,6,1,14.99],[5,6,4,6.99],[5,7,0,120.94],[5,7,1,64.89],[5,8,0,47.41],[5,8,2,7.98],[5,9,0,78.92],[5,9,1,15.96],[5,9,2,11.99],[5,10,0,125.85],[5,10,1,149.89],[5,10,2,23.48],[5,11,0,266.7],[5,11,1,62.96],[5,11,2,34.99],[5,11,3,5.99],[5,11,4,6.99],[5,12,0,412.13],[5,12,1,45.45],[5,12,2,4.0],[5,13,0,263.94],[5,13,1,71.95],[5,13,2,27.84],[5,13,3,7.99],[5,14,0,293.47],[5,14,1,98.88],[5,14,2,13.98],[5,15,0,513.54],[5,15,1,106.22],[5,15,3,25.57],[5,16,0,476.87],[5,16,1,214.54],[5,16,2,26.65],[5,17,0,411.62],[5,17,1,157.32],[5,17,2,39.94],[5,17,3,57.96],[5,18,0,151.32],[5,18,1,208.42],[5,18,2,18.16],[5,18,3,58.95],[5,18,4,19.99],[5,19,0,256.76],[5,19,1,130.91],[5,19,2,16.99],[5,19,3,6.5],[5,20,0,155.4],[5,20,1,121.92],[5,20,2,22.99],[5,21,0,118.77],[5,21,1,67.39],[5,21,2,1.67],[5,22,0,107.9],[5,22,1,33.97],[5,22,2,4.99],[5,23,0,30.97],[5,23,1,24.98],[6,0,0,66.46],[6,0,1,39.99],[6,0,3,2.0],[6,1,2,35.81],[6,2,1,1.5],[6,3,0,0.99],[6,4,0,9.99],[6,4,1,7.99],[6,6,0,18.34],[6,6,1,1.99],[6,7,0,15.31],[6,8,0,107.92],[6,8,1,30.94],[6,9,0,126.28],[6,9,1,54.45],[6,9,2,11.98],[6,10,0,149.68],[6,10,1,63.28],[6,10,2,3.24],[6,10,4,4.99],[6,11,0,183.16],[6,11,1,111.34],[6,12,0,276.86],[6,12,1,58.96],[6,12,2,15.0],[6,12,3,4.99],[6,13,0,256.74],[6,13,1,115.01],[6,13,2,23.0],[6,13,3,15.76],[6,14,0,202.97],[6,14,1,83.58],[6,15,0,235.45],[6,15,1,134.21],[6,15,2,7.99],[6,16,0,289.48],[6,16,1,66.3],[6,16,2,25.88],[6,16,3,9.98],[6,17,0,343.64],[6,17,1,126.55],[6,17,2,48.33],[6,17,3,14.95],[6,17,4,12.98],[6,18,0,338.92],[6,18,1,78.61],[6,18,2,11.96],[6,18,3,3.99],[6,18,4,11.98],[6,19,0,264.27],[6,19,1,77.9],[6,19,2,2.0],[6,19,3,12.99],[6,20,0,153.82],[6,20,1,127.01],[6,20,2,4.99],[6,20,4,8.99],[6,21,0,115.25],[6,21,1,39.04],[6,22,0,58.87],[6,22,1,24.99],[6,22,2,12.99],[6,23,0,10.0],[6,23,1,41.76],[7,0,0,2.99],[7,1,1,1.0],[7,2,1,2.99],[7,4,1,9.99],[7,5,0,17.98],[7,5,1,23.97],[7,6,0,2.0],[7,7,0,36.97],[7,7,2,22.95],[7,7,3,18.94],[7,8,0,108.8],[7,8,1,66.89],[7,8,2,55.97],[7,8,3,5.99],[7,9,0,127.99],[7,9,1,12.99],[7,10,0,226.26],[7,10,1,164.9],[7,10,2,3.0],[7,11,0,199.65],[7,11,1,89.18],[7,11,2,21.97],[7,11,4,5.0],[7,12,0,275.21],[7,12,1,90.44],[7,12,2,2.5],[7,12,4,6.99],[7,13,0,456.33],[7,13,1,44.93],[7,13,2,2.99],[7,13,3,5.0],[7,14,0,435.36],[7,14,1,59.93],[7,14,2,5.99],[7,15,0,308.49],[7,15,1,127.23],[7,15,2,46.91],[7,15,3,5.99],[7,16,0,351.66],[7,16,1,109.92],[7,16,2,49.96],[7,16,4,27.99],[7,17,0,575.41],[7,17,1,194.61],[7,17,3,14.99],[7,18,0,449.75],[7,18,1,482.62],[7,18,2,9.28],[7,18,3,8.99],[7,19,0,291.79],[7,19,1,150.08],[7,19,2,30.45],[7,20,0,243.47],[7,20,1,125.86],[7,20,3,6.99],[7,20,4,13.98],[7,21,0,221.03],[7,21,1,19.98],[7,21,2,23.97],[7,22,0,73.91],[7,22,1,122.88],[7,22,3,9.99],[7,23,0,41.97],[7,23,1,10.98],[7,23,4,12.99]]}