{"grao":"1 linha por dia do ciclo × hora × grupo, departamento COSMETICS, base inteira","dimensoes":{"grupo":["Fiéis","Regulares","Em pausa","Esporádicos","Sem segmento"]},"colunas":["dia_semana","hora","grupo","faturamento"],"linhas":[[1,0,0,25.29],[1,0,1,8.62],[1,1,0,13.98],[1,1,1,4.99],[1,2,0,7.49],[1,2,1,0.99],[1,3,0,5.78],[1,3,1,1.79],[1,5,1,1.49],[1,6,0,0.99],[1,7,0,10.49],[1,7,1,2.99],[1,7,2,36.49],[1,8,0,64.36],[1,8,1,15.81],[1,9,0,43.82],[1,9,1,18.23],[1,10,0,149.15],[1,10,1,67.37],[1,11,0,198.3],[1,11,1,53.57],[1,11,3,8.83],[1,11,2,5.99],[1,12,0,335.49],[1,12,1,107.22],[1,12,3,13.86],[1,12,2,6.69],[1,13,0,278.86],[1,13,1,131.05],[1,13,3,4.0],[1,13,4,8.99],[1,14,0,320.34],[1,14,1,122.67],[1,14,3,23.81],[1,14,4,13.6],[1,15,0,280.68],[1,15,1,122.49],[1,15,3,4.57],[1,15,2,17.02],[1,16,0,385.47],[1,16,1,55.75],[1,16,3,6.22],[1,16,2,8.17],[1,17,0,332.82],[1,17,1,97.98],[1,17,3,15.43],[1,17,2,24.86],[1,18,0,384.49],[1,18,1,95.77],[1,18,3,6.46],[1,18,2,7.54],[1,19,0,240.81],[1,19,1,82.69],[1,20,0,148.41],[1,20,1,53.95],[1,20,3,7.38],[1,20,2,2.74],[1,21,0,175.9],[1,21,1,14.98],[1,21,3,20.96],[1,21,2,4.19],[1,22,0,111.6],[1,22,1,62.71],[1,22,3,99.93],[1,23,0,22.58],[1,23,1,13.06],[1,23,3,4.48],[1,23,4,1.12],[2,0,0,26.82],[2,0,1,12.18],[2,0,3,3.48],[2,1,0,1.49],[2,1,1,11.29],[2,1,3,1.99],[2,2,1,3.22],[2,3,0,25.97],[2,7,0,0.99],[2,7,1,76.56],[2,7,2,1.07],[2,8,0,86.2],[2,8,1,9.37],[2,9,0,51.55],[2,9,1,21.06],[2,9,3,6.04],[2,9,2,12.04],[2,10,0,188.93],[2,10,1,22.79],[2,10,3,2.39],[2,10,2,4.49],[2,11,0,241.3],[2,11,1,63.89],[2,12,0,303.43],[2,12,1,74.81],[2,12,3,11.2],[2,12,2,1.0],[2,13,0,341.95],[2,13,1,190.1],[2,13,3,15.23],[2,14,0,355.46],[2,14,1,117.25],[2,14,3,16.03],[2,14,2,35.52],[2,15,0,406.58],[2,15,1,124.11],[2,15,3,10.29],[2,15,4,8.19],[2,16,0,439.87],[2,16,1,72.88],[2,16,3,28.09],[2,16,2,8.54],[2,17,0,340.85],[2,17,1,79.17],[2,17,3,8.18],[2,17,2,8.4],[2,18,0,370.16],[2,18,1,80.95],[2,18,3,16.91],[2,18,2,2.78],[2,19,0,314.42],[2,19,1,133.82],[2,19,3,19.95],[2,20,0,251.57],[2,20,1,61.19],[2,20,3,10.46],[2,20,2,3.99],[2,21,0,88.18],[2,21,1,45.24],[2,22,0,65.91],[2,22,1,10.57],[2,23,0,21.28],[2,23,1,10.23],[3,0,0,5.22],[3,0,1,2.78],[3,1,0,7.39],[3,2,0,0.66],[3,2,1,13.23],[3,2,2,0.99],[3,3,0,15.88],[3,3,1,1.12],[3,6,0,4.25],[3,6,1,3.43],[3,7,0,17.32],[3,7,1,2.39],[3,8,0,37.66],[3,8,1,4.58],[3,9,0,70.54],[3,9,1,2.79],[3,10,0,85.36],[3,10,1,54.02],[3,10,3,4.99],[3,10,2,10.68],[3,11,0,150.51],[3,11,1,33.06],[3,11,3,11.66],[3,12,0,305.18],[3,12,1,34.9],[3,12,2,6.34],[3,13,0,177.82],[3,13,1,80.66],[3,13,3,50.8],[3,14,0,162.36],[3,14,1,62.49],[3,14,3,8.5],[3,14,2,16.6],[3,14,4,2.42],[3,15,0,288.48],[3,15,1,80.6],[3,15,2,18.03],[3,16,0,216.48],[3,16,1,68.54],[3,16,3,22.99],[3,16,2,3.99],[3,16,4,7.19],[3,17,0,314.51],[3,17,1,91.38],[3,17,3,25.56],[3,17,2,6.48],[3,17,4,16.45],[3,18,0,299.9],[3,18,1,115.51],[3,18,3,18.47],[3,18,2,9.98],[3,18,4,4.99],[3,19,0,160.25],[3,19,1,99.07],[3,19,2,21.43],[3,19,4,6.49],[3,20,0,176.47],[3,20,1,52.26],[3,20,3,5.24],[3,20,2,11.96],[3,21,0,95.18],[3,21,1,41.96],[3,21,3,12.28],[3,22,0,67.42],[3,22,1,39.69],[3,23,0,11.5],[3,23,1,17.48],[4,0,1,17.97],[4,0,3,1.79],[4,1,0,22.28],[4,2,0,13.99],[4,4,1,3.62],[4,5,0,10.97],[4,5,1,2.19],[4,6,0,2.29],[4,7,0,9.99],[4,7,1,5.59],[4,7,3,1.99],[4,8,0,62.44],[4,8,1,24.51],[4,8,3,4.78],[4,9,0,87.42],[4,9,1,8.18],[4,10,0,175.61],[4,10,1,34.4],[4,10,3,7.68],[4,11,0,108.81],[4,11,1,11.36],[4,11,3,7.47],[4,12,0,208.33],[4,12,1,68.64],[4,12,3,23.95],[4,13,0,163.57],[4,13,1,40.29],[4,13,3,4.79],[4,13,2,20.6],[4,14,0,204.43],[4,14,1,30.86],[4,14,3,23.59],[4,14,2,14.72],[4,15,0,192.62],[4,15,1,17.39],[4,15,3,0.99],[4,15,2,32.53],[4,16,0,229.89],[4,16,1,59.57],[4,16,3,15.75],[4,16,2,9.26],[4,16,4,1.45],[4,17,0,241.31],[4,17,1,80.34],[4,17,3,13.26],[4,17,2,26.95],[4,18,0,354.76],[4,18,1,145.7],[4,18,3,19.78],[4,18,2,8.69],[4,18,4,4.99],[4,19,0,296.32],[4,19,1,85.51],[4,19,3,20.46],[4,19,2,10.25],[4,20,0,190.55],[4,20,1,100.32],[4,20,2,14.7],[4,21,0,173.37],[4,21,1,78.71],[4,21,2,1.12],[4,22,0,65.42],[4,22,1,48.24],[4,22,3,6.64],[4,22,2,7.79],[4,23,0,6.56],[4,23,1,30.82],[4,23,2,4.98],[4,23,4,13.78],[5,0,0,6.29],[5,0,1,6.58],[5,1,0,6.68],[5,1,1,18.32],[5,2,0,3.35],[5,3,0,32.21],[5,4,0,22.48],[5,5,0,3.29],[5,6,0,0.72],[5,6,3,7.18],[5,7,0,31.77],[5,7,3,3.59],[5,8,0,49.11],[5,8,1,0.99],[5,9,0,60.51],[5,9,1,29.2],[5,9,2,4.99],[5,10,0,83.21],[5,10,1,25.83],[5,10,3,3.08],[5,10,2,1.67],[5,11,0,126.13],[5,11,1,116.54],[5,11,3,15.8],[5,12,0,212.01],[5,12,1,37.27],[5,12,3,11.77],[5,12,2,19.97],[5,12,4,1.99],[5,13,0,195.16],[5,13,1,32.6],[5,14,0,139.48],[5,14,1,101.53],[5,14,3,10.31],[5,14,2,46.39],[5,15,0,149.22],[5,15,1,76.36],[5,15,3,12.04],[5,15,2,4.48],[5,15,4,3.11],[5,16,0,238.17],[5,16,1,77.27],[5,16,3,6.37],[5,16,2,27.87],[5,17,0,321.57],[5,17,1,67.95],[5,17,3,18.51],[5,18,0,157.72],[5,18,1,168.67],[5,18,3,19.1],[5,18,2,7.49],[5,19,0,240.17],[5,19,1,267.9],[5,19,2,14.94],[5,19,4,19.7],[5,20,0,328.56],[5,20,1,147.38],[5,20,3,11.24],[5,20,4,8.5],[5,21,0,183.29],[5,21,1,53.47],[5,21,3,4.18],[5,22,0,75.79],[5,22,1,46.88],[5,23,0,45.59],[5,23,1,6.87],[5,23,3,2.21],[6,0,0,34.15],[6,0,1,1.59],[6,1,3,2.44],[6,2,0,5.98],[6,5,0,2.74],[6,6,0,11.37],[6,6,1,12.74],[6,7,0,15.63],[6,7,1,4.85],[6,7,3,1.0],[6,8,0,24.7],[6,8,1,21.44],[6,8,3,9.98],[6,9,0,125.1],[6,9,1,55.17],[6,9,2,1.19],[6,10,0,131.88],[6,10,1,17.47],[6,11,0,190.1],[6,11,1,55.37],[6,12,0,129.91],[6,12,1,25.95],[6,13,0,165.87],[6,13,1,31.96],[6,13,3,1.79],[6,13,2,9.18],[6,14,0,340.33],[6,14,1,80.56],[6,14,3,14.88],[6,15,0,302.69],[6,15,1,47.83],[6,15,3,3.79],[6,15,2,6.97],[6,16,0,332.82],[6,16,1,109.85],[6,16,3,4.31],[6,16,2,29.61],[6,17,0,286.92],[6,17,1,65.92],[6,17,3,22.31],[6,17,2,9.72],[6,17,4,8.98],[6,18,0,286.44],[6,18,1,53.74],[6,18,2,39.99],[6,19,0,271.63],[6,19,1,101.47],[6,19,3,2.89],[6,19,2,15.48],[6,20,0,228.2],[6,20,1,85.87],[6,20,3,18.78],[6,20,2,44.59],[6,21,0,191.52],[6,21,1,71.24],[6,21,3,7.98],[6,21,2,1.69],[6,22,0,47.0],[6,22,1,16.03],[6,22,3,10.95],[6,22,4,4.78],[6,23,0,111.09],[6,23,1,21.47],[7,0,0,3.99],[7,0,1,15.27],[7,1,0,29.33],[7,1,1,4.0],[7,1,3,12.67],[7,2,0,23.92],[7,2,1,4.69],[7,2,2,1.5],[7,3,0,5.98],[7,4,0,18.12],[7,6,0,3.49],[7,7,0,49.02],[7,7,1,5.17],[7,8,0,13.23],[7,8,1,11.56],[7,8,2,11.99],[7,9,0,87.96],[7,9,1,56.56],[7,9,3,7.19],[7,9,2,0.99],[7,10,0,93.67],[7,10,1,28.69],[7,10,3,6.68],[7,10,2,0.99],[7,11,0,201.41],[7,11,1,55.65],[7,11,3,3.49],[7,12,0,169.47],[7,12,1,65.32],[7,12,3,23.88],[7,12,2,22.36],[7,13,0,316.38],[7,13,1,66.68],[7,13,3,22.86],[7,14,0,262.79],[7,14,1,90.41],[7,14,3,12.98],[7,14,2,14.48],[7,15,0,255.95],[7,15,1,68.59],[7,15,3,3.49],[7,16,0,238.91],[7,16,1,66.24],[7,16,3,32.18],[7,16,2,17.44],[7,16,4,4.42],[7,17,0,425.12],[7,17,1,91.22],[7,17,2,26.35],[7,18,0,326.92],[7,18,1,96.29],[7,18,3,2.75],[7,19,0,211.44],[7,19,1,92.62],[7,19,3,47.09],[7,19,2,67.93],[7,20,0,218.76],[7,20,1,107.49],[7,21,0,141.56],[7,21,1,56.15],[7,21,3,1.25],[7,21,2,7.32],[7,22,0,71.37],[7,22,1,64.13],[7,22,3,7.09],[7,22,2,0.99],[7,23,0,74.54],[7,23,1,46.05],[7,23,3,0.99]]}