{"grao":"1 linha por dia do ciclo × hora × grupo, departamento TRAVEL & LEISUR, base inteira","dimensoes":{"grupo":["Fiéis","Regulares","Esporádicos","Em pausa","Sem segmento"]},"colunas":["dia_semana","hora","grupo","faturamento"],"linhas":[[1,0,0,2.0],[1,2,0,5.79],[1,6,1,1.88],[1,9,1,10.77],[1,10,0,5.24],[1,10,1,4.24],[1,11,0,10.96],[1,11,1,16.14],[1,12,0,11.71],[1,12,1,4.85],[1,12,2,3.53],[1,12,3,1.1],[1,13,0,40.04],[1,13,1,2.1],[1,14,0,19.05],[1,14,1,5.68],[1,14,2,3.47],[1,15,0,10.43],[1,15,1,6.23],[1,16,0,23.77],[1,16,1,16.51],[1,17,0,27.92],[1,17,1,24.79],[1,17,2,2.0],[1,18,0,20.02],[1,18,1,7.63],[1,18,2,7.15],[1,19,0,28.21],[1,19,1,1.69],[1,20,0,16.95],[1,20,1,4.94],[1,21,0,4.66],[1,22,0,1.46],[1,22,1,7.99],[1,23,0,2.0],[2,0,0,3.49],[2,8,0,3.74],[2,9,0,7.92],[2,9,1,2.48],[2,9,2,5.79],[2,10,0,7.42],[2,10,1,4.69],[2,11,0,27.68],[2,11,1,6.01],[2,11,2,2.57],[2,12,0,26.11],[2,12,1,5.4],[2,13,0,14.05],[2,13,1,6.52],[2,13,2,2.0],[2,14,0,56.53],[2,14,1,12.86],[2,14,2,7.02],[2,15,0,46.05],[2,15,1,11.51],[2,16,0,19.2],[2,16,1,5.6],[2,17,0,35.97],[2,17,1,11.95],[2,18,0,21.93],[2,18,1,15.97],[2,18,2,3.28],[2,19,0,3.08],[2,19,1,5.69],[2,19,2,3.74],[2,20,0,20.2],[2,20,1,10.62],[2,20,2,2.5],[2,21,0,4.5],[2,21,1,4.68],[2,22,0,3.79],[2,22,1,4.0],[3,0,2,1.0],[3,1,1,0.92],[3,7,0,6.51],[3,9,0,4.71],[3,9,1,0.86],[3,9,2,3.79],[3,9,3,3.99],[3,10,1,2.0],[3,11,0,22.24],[3,11,1,9.77],[3,11,3,3.38],[3,12,0,9.72],[3,12,1,3.22],[3,13,0,17.54],[3,13,1,2.5],[3,14,0,23.37],[3,14,1,4.41],[3,15,0,8.05],[3,15,1,14.1],[3,16,0,24.78],[3,16,1,15.76],[3,17,0,15.55],[3,17,1,14.36],[3,17,2,0.86],[3,17,3,3.79],[3,18,0,31.0],[3,18,1,4.81],[3,18,2,0.86],[3,18,3,3.79],[3,19,0,33.83],[3,19,1,2.28],[3,20,0,15.62],[3,20,1,30.06],[3,20,2,3.23],[3,21,0,16.86],[3,21,1,2.5],[3,22,0,7.2],[3,22,1,10.28],[3,22,3,1.64],[3,23,1,6.88],[4,9,2,9.09],[4,10,0,7.8],[4,11,0,13.44],[4,11,1,2.16],[4,12,0,25.32],[4,12,1,2.0],[4,12,2,1.08],[4,13,0,9.8],[4,13,1,11.38],[4,14,0,26.34],[4,14,1,12.36],[4,14,4,5.87],[4,15,0,12.82],[4,15,1,11.44],[4,15,2,5.79],[4,16,0,31.97],[4,16,1,2.0],[4,17,0,34.67],[4,17,1,10.99],[4,18,0,16.18],[4,18,1,9.29],[4,18,2,1.88],[4,19,0,24.12],[4,19,1,11.87],[4,20,0,15.12],[4,20,1,2.5],[4,20,2,2.0],[4,20,3,3.79],[4,21,0,17.6],[4,21,1,10.36],[4,22,0,4.0],[4,22,1,1.0],[4,23,0,2.51],[5,2,0,1.6],[5,7,0,2.5],[5,8,1,1.99],[5,9,0,7.79],[5,10,1,3.0],[5,11,0,5.7],[5,11,1,6.09],[5,12,0,10.79],[5,12,1,2.2],[5,13,0,25.95],[5,13,1,5.77],[5,14,0,9.79],[5,14,1,10.57],[5,15,0,17.78],[5,15,1,2.5],[5,16,0,14.32],[5,16,1,4.41],[5,17,0,20.93],[5,17,1,7.44],[5,18,0,23.38],[5,18,1,12.54],[5,18,2,2.5],[5,19,0,24.46],[5,19,1,26.42],[5,20,0,8.29],[5,20,1,12.51],[5,21,0,13.57],[5,21,1,14.12],[5,22,0,4.5],[5,22,1,2.61],[5,22,2,0.89],[6,0,0,2.5],[6,8,0,6.9],[6,9,0,1.15],[6,10,0,17.94],[6,10,1,16.7],[6,11,0,7.32],[6,11,1,3.79],[6,12,0,23.44],[6,12,1,9.93],[6,13,0,25.39],[6,13,1,3.22],[6,14,0,11.09],[6,14,1,13.98],[6,15,0,24.49],[6,15,1,6.57],[6,15,2,2.86],[6,16,0,26.39],[6,16,1,11.76],[6,17,0,40.46],[6,17,1,3.96],[6,17,2,6.29],[6,18,0,8.79],[6,18,1,5.0],[6,19,0,31.26],[6,19,1,2.5],[6,20,0,11.08],[6,20,1,19.16],[6,21,0,12.38],[6,21,1,12.58],[6,22,0,6.29],[6,22,1,6.71],[7,3,0,8.25],[7,6,1,2.19],[7,7,0,4.06],[7,8,0,2.0],[7,8,1,1.0],[7,9,0,12.3],[7,10,0,11.54],[7,10,1,2.03],[7,11,0,6.72],[7,12,0,9.14],[7,12,1,2.7],[7,13,0,6.81],[7,13,1,2.59],[7,14,0,9.16],[7,14,1,8.46],[7,15,0,35.0],[7,15,1,7.67],[7,15,2,5.12],[7,15,3,2.5],[7,16,0,7.96],[7,16,1,10.9],[7,16,2,10.22],[7,17,0,4.5],[7,17,1,2.18],[7,18,0,34.95],[7,18,1,13.81],[7,18,3,2.5],[7,19,0,7.33],[7,19,1,6.12],[7,20,0,20.9],[7,20,1,8.79],[7,20,3,2.0],[7,21,0,15.31],[7,21,1,2.0],[7,22,0,4.56],[7,22,1,2.83]]}