{"grao":"1 linha por dia do ciclo × hora × grupo, departamento FROZEN GROCERY, base inteira","dimensoes":{"grupo":["Fiéis","Regulares","Esporádicos","Em pausa","Sem segmento"]},"colunas":["dia_semana","hora","grupo","faturamento"],"linhas":[[1,1,0,2.1],[1,9,0,1.99],[1,9,1,3.65],[1,10,0,2.54],[1,11,0,3.73],[1,11,1,3.2],[1,12,0,0.96],[1,12,1,4.29],[1,13,1,3.89],[1,14,0,26.33],[1,14,1,2.85],[1,15,0,10.66],[1,16,0,14.22],[1,17,0,7.05],[1,17,1,1.64],[1,18,0,0.33],[1,18,1,20.86],[1,19,1,2.99],[1,21,0,1.99],[1,21,2,1.95],[1,23,0,1.97],[2,0,1,3.21],[2,7,0,3.29],[2,9,1,9.87],[2,10,0,4.74],[2,11,0,12.82],[2,11,1,0.75],[2,12,0,12.85],[2,12,1,3.29],[2,13,0,5.96],[2,14,0,15.98],[2,14,1,10.88],[2,16,0,3.12],[2,16,1,1.16],[2,16,2,1.62],[2,16,3,3.38],[2,17,0,5.98],[2,17,1,3.18],[2,18,0,5.77],[2,19,0,20.8],[2,20,0,4.5],[2,21,0,5.51],[2,22,2,1.69],[3,10,0,3.29],[3,11,0,5.98],[3,12,1,3.94],[3,13,0,2.86],[3,14,0,5.08],[3,16,0,2.5],[3,16,1,3.43],[3,16,3,1.99],[3,17,0,11.02],[3,18,0,3.29],[3,18,1,4.51],[3,19,0,4.93],[3,19,1,13.03],[3,19,4,3.67],[3,20,0,8.21],[3,20,1,2.62],[3,21,0,3.16],[3,21,1,2.5],[3,22,0,4.68],[4,9,0,2.99],[4,10,0,1.16],[4,10,1,2.93],[4,11,1,3.29],[4,12,1,2.5],[4,14,0,1.69],[4,14,3,1.89],[4,15,0,2.89],[4,16,0,15.49],[4,16,1,1.69],[4,17,0,1.99],[4,17,1,2.99],[4,18,0,3.08],[4,18,1,2.99],[4,19,0,2.74],[4,19,1,1.0],[4,20,1,5.4],[4,21,1,0.95],[4,22,0,1.65],[5,10,0,5.48],[5,11,0,4.8],[5,11,1,2.99],[5,12,0,2.49],[5,12,1,3.04],[5,13,1,4.67],[5,14,0,5.31],[5,14,1,0.99],[5,15,0,10.03],[5,15,1,1.17],[5,16,0,5.97],[5,18,0,1.73],[5,18,1,4.29],[5,19,0,8.73],[5,21,0,11.84],[5,22,0,4.26],[5,23,0,8.37],[6,0,0,6.19],[6,7,0,1.0],[6,8,0,0.91],[6,9,0,1.2],[6,10,0,1.69],[6,10,1,3.29],[6,11,0,8.98],[6,12,0,3.29],[6,13,0,15.04],[6,14,0,1.06],[6,15,0,4.32],[6,15,1,2.7],[6,16,0,1.99],[6,16,1,3.2],[6,17,0,1.04],[6,17,1,1.69],[6,18,0,1.3],[6,18,2,1.13],[6,19,0,1.71],[6,19,1,3.0],[6,20,0,6.28],[6,23,4,0.82],[7,8,0,0.99],[7,10,1,6.09],[7,11,0,1.69],[7,13,0,3.38],[7,14,0,3.28],[7,15,0,14.02],[7,17,0,5.08],[7,17,1,3.68],[7,18,1,4.09],[7,19,0,7.27],[7,20,0,3.29],[7,20,1,3.6],[7,21,0,9.3],[7,21,1,3.65],[7,22,0,7.31],[7,22,1,2.0]]}