{"grao":"1 linha por dia do ciclo × hora × grupo, departamento SEAFOOD, base inteira","dimensoes":{"grupo":["Regulares","Fiéis","Esporádicos","Em pausa","Sem segmento"]},"colunas":["dia_semana","hora","grupo","faturamento"],"linhas":[[1,8,0,31.67],[1,9,1,75.59],[1,9,0,23.32],[1,9,2,10.03],[1,10,1,325.9],[1,10,0,28.88],[1,10,2,9.94],[1,10,3,3.29],[1,11,1,288.86],[1,11,0,94.68],[1,11,2,17.17],[1,12,1,477.79],[1,12,0,117.96],[1,12,2,46.71],[1,13,1,405.5],[1,13,0,202.73],[1,13,2,25.96],[1,13,3,14.62],[1,13,4,28.97],[1,14,1,348.88],[1,14,0,67.79],[1,14,2,17.8],[1,15,1,447.34],[1,15,0,128.72],[1,16,1,485.77],[1,16,0,116.84],[1,16,2,32.86],[1,17,1,505.71],[1,17,0,226.66],[1,17,2,15.74],[1,17,4,15.17],[1,18,1,276.74],[1,18,0,109.36],[1,18,3,18.25],[1,18,4,6.99],[1,19,1,173.46],[1,19,0,78.82],[1,19,2,2.54],[1,20,1,150.99],[1,20,0,79.62],[1,20,2,7.33],[1,20,3,12.53],[1,21,1,25.97],[1,21,0,19.74],[1,21,2,4.4],[1,22,1,16.44],[1,23,1,25.98],[2,8,1,12.74],[2,9,1,22.91],[2,9,0,9.84],[2,9,2,2.54],[2,10,1,116.03],[2,10,0,17.2],[2,10,2,16.21],[2,10,3,3.98],[2,11,1,248.46],[2,11,0,115.97],[2,11,2,7.2],[2,12,1,399.01],[2,12,0,130.84],[2,12,2,8.88],[2,12,3,15.84],[2,12,4,7.13],[2,13,1,316.18],[2,13,0,108.33],[2,13,2,20.23],[2,13,3,14.97],[2,14,1,486.4],[2,14,0,125.23],[2,14,2,43.75],[2,14,3,2.98],[2,15,1,486.93],[2,15,0,114.85],[2,15,2,23.92],[2,16,1,423.78],[2,16,0,141.35],[2,16,2,23.5],[2,16,3,13.98],[2,16,4,3.54],[2,17,1,514.48],[2,17,0,78.65],[2,17,2,27.04],[2,17,3,3.56],[2,18,1,255.2],[2,18,0,131.65],[2,18,2,6.78],[2,18,3,23.44],[2,18,4,8.53],[2,19,1,207.94],[2,19,0,65.4],[2,19,2,3.14],[2,20,1,199.9],[2,20,0,60.16],[2,21,1,62.96],[2,21,0,17.12],[2,21,2,16.73],[2,22,1,5.19],[2,22,0,2.54],[2,22,3,6.63],[2,23,1,7.61],[3,0,0,7.78],[3,0,4,4.04],[3,5,0,3.15],[3,8,1,2.7],[3,9,1,51.19],[3,10,1,63.74],[3,10,0,73.34],[3,10,2,2.94],[3,11,1,142.06],[3,11,0,93.22],[3,12,1,113.44],[3,12,0,64.14],[3,12,2,20.04],[3,12,3,10.0],[3,13,1,208.3],[3,13,0,78.87],[3,13,2,31.04],[3,14,1,279.57],[3,14,0,64.61],[3,14,4,5.54],[3,15,1,293.25],[3,15,0,49.95],[3,15,2,17.0],[3,15,3,8.54],[3,16,1,237.77],[3,16,0,41.4],[3,16,3,6.36],[3,16,4,15.91],[3,17,1,352.78],[3,17,0,92.33],[3,17,2,11.34],[3,17,3,10.64],[3,18,1,343.05],[3,18,0,107.56],[3,18,2,33.19],[3,19,1,204.46],[3,19,0,144.25],[3,20,1,153.65],[3,20,0,37.13],[3,20,2,1.68],[3,20,3,5.47],[3,20,4,12.15],[3,21,1,37.54],[3,22,1,19.38],[3,22,0,0.47],[3,23,0,4.99],[3,23,4,3.37],[4,2,1,11.6],[4,2,3,1.64],[4,8,0,1.27],[4,9,1,15.42],[4,9,0,24.13],[4,10,1,54.99],[4,10,0,68.76],[4,10,2,2.99],[4,10,3,4.47],[4,11,1,163.71],[4,11,0,144.18],[4,11,2,25.26],[4,11,3,6.88],[4,12,1,206.42],[4,12,0,29.48],[4,12,2,9.98],[4,12,3,12.77],[4,13,1,253.27],[4,13,0,25.93],[4,14,1,275.85],[4,14,0,26.35],[4,14,2,7.03],[4,14,3,10.79],[4,15,1,369.98],[4,15,0,35.77],[4,15,3,15.42],[4,16,1,287.24],[4,16,0,88.94],[4,16,2,3.0],[4,16,3,5.0],[4,17,1,476.1],[4,17,0,111.7],[4,17,2,38.35],[4,17,3,7.03],[4,18,1,289.26],[4,18,0,60.65],[4,18,2,8.68],[4,18,3,19.86],[4,19,1,111.8],[4,19,0,116.95],[4,19,2,15.15],[4,20,1,122.72],[4,20,0,27.36],[4,20,2,3.69],[4,21,1,36.08],[4,21,0,13.0],[4,22,1,12.09],[4,22,0,5.53],[4,23,1,10.47],[5,8,0,5.33],[5,8,3,11.6],[5,9,1,38.63],[5,9,0,10.08],[5,10,1,111.43],[5,10,0,27.46],[5,10,2,18.16],[5,11,1,167.04],[5,11,0,52.0],[5,11,2,23.82],[5,11,3,7.69],[5,11,4,7.95],[5,12,1,153.46],[5,12,0,29.79],[5,12,2,5.96],[5,12,3,23.59],[5,12,4,6.83],[5,13,1,166.59],[5,13,0,78.41],[5,13,2,10.23],[5,14,1,274.32],[5,14,0,83.18],[5,14,2,14.5],[5,15,1,296.68],[5,15,0,77.33],[5,15,2,48.77],[5,16,1,227.22],[5,16,0,59.54],[5,16,2,7.2],[5,16,3,4.26],[5,17,1,314.7],[5,17,0,89.72],[5,17,2,18.61],[5,18,1,159.32],[5,18,0,75.84],[5,18,2,3.74],[5,18,3,5.96],[5,18,4,22.26],[5,19,1,178.27],[5,19,0,136.03],[5,19,2,12.85],[5,20,1,94.61],[5,20,0,71.94],[5,21,1,55.05],[5,21,0,39.9],[5,21,2,6.78],[5,22,1,19.87],[6,8,2,5.59],[6,9,1,42.95],[6,9,0,4.81],[6,9,3,6.4],[6,10,1,65.56],[6,10,0,48.0],[6,10,3,13.81],[6,11,1,184.36],[6,11,0,99.69],[6,11,2,17.46],[6,11,3,13.07],[6,12,1,109.89],[6,12,0,14.02],[6,12,3,17.07],[6,12,4,7.83],[6,13,1,202.14],[6,13,0,68.11],[6,13,2,30.29],[6,13,3,6.99],[6,14,1,186.42],[6,14,0,32.59],[6,14,3,14.37],[6,15,1,151.79],[6,15,0,93.91],[6,15,2,25.94],[6,15,3,22.85],[6,16,1,268.63],[6,16,0,46.04],[6,16,2,7.54],[6,16,3,8.88],[6,16,4,10.97],[6,17,1,429.89],[6,17,0,128.78],[6,17,2,22.52],[6,18,1,195.91],[6,18,0,46.29],[6,18,2,26.2],[6,19,1,233.87],[6,19,0,105.66],[6,19,2,5.85],[6,19,3,5.96],[6,20,1,76.69],[6,20,0,48.88],[6,20,3,7.06],[6,21,1,44.74],[6,21,0,28.1],[6,22,1,18.61],[6,22,0,71.56],[6,23,2,4.02],[6,23,4,4.94],[7,4,3,2.09],[7,8,2,29.99],[7,9,1,93.21],[7,9,0,16.68],[7,10,1,121.38],[7,10,0,27.44],[7,10,2,3.57],[7,10,3,4.67],[7,11,1,312.76],[7,11,0,71.37],[7,11,2,10.96],[7,11,3,21.24],[7,12,1,401.17],[7,12,0,27.68],[7,12,2,2.55],[7,13,1,310.54],[7,13,0,88.61],[7,13,2,13.16],[7,13,3,7.27],[7,14,1,397.48],[7,14,0,53.66],[7,14,2,16.52],[7,14,3,15.64],[7,15,1,389.16],[7,15,0,79.63],[7,15,2,4.55],[7,16,1,315.29],[7,16,0,80.71],[7,16,2,29.65],[7,16,3,27.07],[7,17,1,296.81],[7,17,0,100.4],[7,17,2,4.74],[7,18,1,251.65],[7,18,0,114.74],[7,18,2,14.2],[7,18,4,4.59],[7,19,1,129.09],[7,19,0,83.93],[7,19,2,19.92],[7,20,1,143.36],[7,20,0,114.32],[7,21,1,83.11],[7,21,0,30.46],[7,22,1,15.42],[7,22,0,25.2],[7,23,1,2.99],[7,23,0,4.47]]}